Shutterstock,"a global marketplace for images, videos and music. sharing photos, inspiration, design tips & videos for the creative community."
Blissful_Eats,"clean food that tastes great while providing energy & nutrients! no guilt granola, vegan/paleo friendly options too! cert organic, gf, kosher"
eliseotecleo,highly extraordinary auctions
americacredit,"come join the fastest blog network online today $url$ and $url$ we cover credit repair, credit cards and bankruptcy."
TV_Trax,breaking industry news for people who believe there's no such thing as too much tv. you know who you are $smiley$
click88sure,everything you need to find a job and keep it! follow our tweet for new job posting
USAChildCare,"our nations leading voice for $hashtag$. advocating for affordable, high-quality $hashtag$ for working families. undertakes research & reports on child care data."
lifessubatomic,mirage homage... capri eternal... hopeless romantic... not really hopeles...
Geek_Initiative,a collective of genre specific blogs combining like voltron to provide you with the best coverage imaginable. $mention$ $mention$ $mention$ $mention$
fetchfind,love animals? fetchfind is the new way to find jobs and network for the pet industry. mascot $mention$ $hashtag$
CaronHohner,you can have what you want in life_. advertise your service here for free and get rid of money worries_
SML2020,"team di reporter e giornalisti, lavoriamo con video e web. la nostra giornata tra cronaca, attualit, politica e sport info$mention$.it"
MIASkateShop,"south beach $number$ $number$th street miami beach, fl $number$ $number$21.3511 sunny isles beach $number$ collins ave $hashtag$ sunny isles beach, fl $number$ $number$74.0040"
WFWildcats,official twitter account of the wichita falls wildcats | $mention$ south division est. $number$ | $hashtag$
starsjournal,delivering you up-to-date news from the entertainment world.
TCGJobs,"tcg is a staffing firm that places design, interactive and marketing professionals in freelance and full-time jobs. see all our jobs here!"
thebiglead,"sports, media, opinion. established $number$. contact us: jmcintyre$mention$.com"
AraHelvie,"the card that get you everywhere, anything, anyhow. please use the credit card wisely. please get the tips of using credit card from my site"
DallasTX_News,all the $hashtag$ $hashtag$ news you need in one spot. thanks for following and please send along any suggestions you may have.
AGROWN1,come to agrown's $hashtag$ investor conference and join the convo on $hashtag$ in the us. feat. $mention$ $mention$ $mention$ $hashtag$ $hashtag$
EMA_radio1,weekly hip-hop podcast. new show every wednesday. rooted in hip-hop. limited to nothing. marketing$mention$.com
PaloAltoNews,"curating the best media feeds in palo alto. a city in $url$u, a community service media network supporting the social good"
SndtrcksForever,[en] webradio : music non-stop from fantastic & sci-fi movies and tv shows from the early $number$s to the present day ! [fr] : radio sf et fantastique !
NewsNewark,like my tweets? you can support my work by shopping on amazon via this link. thank you for being a good person $smiley$ $url$
CharaRicken,real estate global network: the social network for real estate professionals
TRSMRyersonU,"home to $number$ schools of management, $number$ bcomm programs, $number$ mba programs, $number$ msc & $number$ innovative research centres, all in the core of downtown toronto."
CAFBTX,the capital area food bank of texas is a nonprofit dedicated to nourishing hungry people and leading the community in ending hunger.
newyorkbuzztap,the latest new york rangers buzz.
4qhks,if you're ever feeling weak just remember that i am strong and i am out there | copilot: $mention$ | trine: $mention$ + $mention$
Geek_Initiative,a collective of genre specific blogs combining like voltron to provide you with the best coverage imaginable. $mention$ $mention$ $mention$ $mention$
SixtaTaraborell,"have you got an adsense publisher account? with this tool, you can multiply your income as many times as you wish! $url$"
EmpireGameNews,a division of on the ground news canada. join your friends reading the latest gaming news on the ground ..
BTLRadioNews,"weekly nationally syndicated alternative radio newsmagazine with timely, in-depth progressive analysis not found in corporate media"
BI_Strategy,the latest business advice and strategy from $mention$.
KimesRanchJeans,"american made jeans built to be the leader in fit, quality, and style. bringing the best parts of the fashion world to the western world."
WarOnTheRocks,e$smiley$erience ~ conflict ~ commentary ~ realism
breakingclenews,"curating the best media feeds in cleveland. a city in $url$, a community service media network supporting civic causes and local arts"
AraHelvie,"the card that get you everywhere, anything, anyhow. please use the credit card wisely. please get the tips of using credit card from my site"
Coralville_IA,"official city of coralville, ia government twitter account. follows/rts endorsement. comment info: $url$0"
ArcticFox2016,bb's official twitter account ~ caution barracuda patrolled waters ~ followed by $mention$ $mention$ $mention$ $mention$ $mention$ $mention$
StripDeals,we tweet las vegas deals and share sin city's secrets along the way - follow if you love $hashtag$ [stripdeals$mention$.com]
JonellChamness,"we are the no. $number$ world fastest growing seo , small & big job services for buyer & seller to meet"
JFedinPhilly,the jewish federation of greater philadelphia's mission is to mobilize financial and volunteer resources to address the community's critical priorities.
click89sure,find the latest jobs/careers in uk. follow our tweet
realtimesydney,"curating the best media feeds in sydney. a city in $url$, a community service media network supporting civic causes and local arts"
RamTechVCU,"vcu's on-campus technology store. proudly serving vcu students, faculty and staff by providing technology products and services under the same roof."
PhoenixCP,phoenix city and press
reginadailynews,"curating the best media feeds in regina. a city in $url$, a community service media network supporting civic causes and local arts"
LacreshaHoggle,the $number$ way baby monitor is very useful both for parents and for babies. the parents can hear the sound of the baby. it is important to choose a reliable one
NancyDewees,"world largest affordable seo market place for seller and buyer , freelancer, small & big jobs online service to meet"
IndianapolisCP,indianapolis city and press
UrbanPlanRR,live content curated by top urban planning influencers
TempieLanehart,"do you want to earn money from bitcoin, let the insider tell you!!"
leafsbuzztap,the latest toronto maple leafs buzz.
dreamteamfc,making giant novelty cheques since $number$.
BeardedReds,we love manchester united. we have beards. we are the bearded reds. we discuss everything united. check the podcast!
belmontnews,"curating the best media feeds in belmont. a city in $url$, a community service media network supporting civic causes and local arts"
BumpinUglies,lyrically driven ska/punk/reggae from the east coast. check out our new release sublime with no one on itunes! proudly sponsored by $mention$.
SPORTalkEagles,sportalk: sports meet social media. this account covers the philadelphia eagles. join sportalk today and get the app! $url$ $hashtag$ $hashtag$
Qrelur,i draw filthy stuff.
CoryBalducci,learn all things about revolution of bitcoin & their opportunities. a very simple way to earn money using bitcoin
Geek_Initiative,a collective of genre specific blogs combining like voltron to provide you with the best coverage imaginable. $mention$ $mention$ $mention$ $mention$
yskBaltimore,"follow ysk baltimore for the latest news in the $hashtag$, $hashtag$ area. $url$"
seomarket1388,"freelance job from seo, design, writing, social media and many more. a place for buyer & seller to meet"
EmpireGameNews,a division of on the ground news canada. join your friends reading the latest gaming news on the ground ..
ConciergeVacSer,offering affordable travel at the best locations.
ECTritons,the official twitter feed of eckerd athletics. follow us for updates galore. member of $mention$ and $mention$.
Chargers_NEFL,u_r_m_a * not affiliated with the nfl or san diego chargers
HomeinHalifax,"a real estate enthusiast working at royal lepage atlantic! looking to sell or purchase, i am a tweet away!"
knarkse_flac,"music library for $mention$, there's gonna be a lot of repeats and garbage"
NewsViewsWorld,just read latest and hot news from all over the $hashtag$ at $mention$
AmazonLaunch,learn how to create your own $hashtag$ bestseller on amazon - $number$ audio sessions will tell you all you need to know.
diyfeed,get updates of whatever is happening on $mention$ in an easy feed.
redwoodcitynow,"curating the best media feeds in redwood city. a city in $url$, a community service media network for the social good"
SRHSNJ,a tradition of excellence for $number$ years!
roseaffair,the rose affair is dedicated to helping poor families who could not afford medicals for their kids.
BI_contributors,"$mention$'s roundup of e$smiley$erts, partners, and news outlets from across the media landscape."
AmzonBestseller,take your business to the next level with am amazon $hashtag$ bestseller - increase your credibility and your income!
OfficeSupport,have a question? follow us and let us help you! product support: $url$2; business support: $url$1
FlightsAndHotel,"uknetguide find a flight or book one of $number$,000 hotels around the world, great deals and offers"
RCDSB,the twitter page of the renfrew county district school board
Buzzalog,"book $hashtag$, amazon $hashtag$ bestseller program, social media programs"
PikePodcasting,pike podcasting. est. $number$. promo. music. sports. lifestyle. entertainment. politics. comics. fantasy. movies. sex. debauchery. what else?
EastPublic143,"welcome to east public school ps143e. our school motto is where the learning starts. enzo guarnaccia, principal"
graceconnectus,connecting people and churches of the fellowship of grace brethren churches
parrythehoot,"concerns: animal welfare, h2o quality, species $mention$ risk, charter rights, plight of wrongly convicted. pls visit & support $url$"
MacTrast,"we deliver apple & mac news to nearly $number$,000 followers on twitter. follow us on g+ at $url$"
treeanglecoid,different angle $mention$ $url$
Bstbookpromos,book promoter
BestsellerSvcs,"book promotions, amazon bestseller campaigns, social media systems and more!"
spiritualcatalg,"a catalog that will change your life with inspirational, motivational, metaphysical books, programs and products and much, much more."
TopBookPromos,"we provide book promotions, amazon bestseller campaigns and social media platforms."
AssystemJobs,"leading global engineering firm providing professional engineering and consulting services to leaders in the aerospace, automotive, energy and nuclear sectors."
diyfeed,get updates of whatever is happening on $mention$ in an easy feed.
Geek_Initiative,a collective of genre specific blogs combining like voltron to provide you with the best coverage imaginable. $mention$ $mention$ $mention$ $mention$
zoevpope,multi award winning bridal hair & make up stylist | event florist | hollywood lash technician
GlobeMetro,"the latest from the $mention$ metro department. tweets by $mention$, $mention$, and $mention$."
Southridge300,official twitter of the miami southridge $number$ club.
MobiHealthNews,leading news source in the mobile and digital health community. covering $hashtag$ $hashtag$ $hashtag$. subscribe here $url$
NodeAstrology,interfaith counselors and life coaches with a focus on north node astrology. we are spiritual advisers and welcome all religious faiths into our fold.
TopTenListsshow,follow us to get the latest news about
PhiladelphiaCP,latest news from philadelphia. updates are frequent.
NationRadio,"real music for wales on $number$ & $number$fm, dab & online. home of the big welsh wake up with niall & ruth! whats on?- $mention$ | news- $mention$"
KitsonLA,"kitson, flagship store on robertson boulevard, is the favorite stop for many celebrities and the who's who in hollywood. oh, did we offend you? $hashtag$"
princetonherald,"the princeton herald is the official newspaper for the city of princeton, texas. visit our website or call $number$-784-6397 to advertise or subscribe."
pesamo188,original content producers will earn from tsu $url$ when their content attracts views.
IndianapolisCP,indianapolis city and press
UnwrittenPix,"video production company filming in tennessee and texas. to us, we are capturing more than a video. it's your story."
shrewsweb,"the official $hashtag$ town football club twitter account, bringing you the latest news from the shrews. $hashtag$ telephone: $number$ $number$."
WomensTimeNet,daily update women blog
johnstownhawks,the johnstown tomahawks are a junior hockey organization and proud member of the north american hockey league.
breakingstlnews,"curating the best media feeds in st louis. a city in $url$, a community service media network supporting civic causes and local arts"
calverthall,a private catholic college prep school for young men
iEPAclimate,"news, analysis and perspective on epa regulations and the climate change policy debate"
Union_Network,the union network is all about entertainment professionals coming together to work and promote collectively as a team.
All_Ways_Apples,celebrating abundance with the $number$th all ways apples festival on wednesday $number$th october $number$. tweets sent by dig for devonport co-ordinator tess wilmot
OneRxApp,"fast and easy prescription savings, right at your fingertips."
KathrynKolasa,earn $hashtag$ through our network $url$ . we sell online advertising! simple product - great potential! we use only $hashtag$! fully automated
FostersDailyDem,"the new hampshire and maine source for news in strafford, rockingham and york counties."
PhoenixCP,phoenix city and press
SailingFansclub,your source for the latest news on sailing
YA_Environment,"yahoo answers: environment,alternative fuel vehicles,conservation,global warming,green living"
OHS_SRC,official twitter account for the ohs src! bringing you the best news and updates! follow us and our exec! $mention$ $mention$ $mention$ $mention$
BarbecueFresh,the meatless grilling guide! live bbq fresh!
HallmarkBiz,"news and insight from the team at hallmark business connections, hallmark's b2b unit."
ACMEBodyPaint,"acme body & paint in jamaica plain, ma is a friendly, knowledgeable, and quality body shop. let us get you back on the road again."
VorongoUSA,$number$% us-based content writers. $hashtag$ $hashtag$ $hashtag$ $hashtag$
WZBC_Live,here's what's currently playing on wzbc $number$fm in boston!
YA_Environment,"yahoo answers: environment,alternative fuel vehicles,conservation,global warming,green living"
AltPress,"the nations leading voice on underground, alternative, punk music and youth culture both in print and online since $number$. follow us for news, music + more!"
YA_Environment,"yahoo answers: environment,alternative fuel vehicles,conservation,global warming,green living"
scmmag,supply chain management news. published daily. $hashtag$ $hashtag$ $hashtag$ $hashtag$
DetroitJobs3,tweets with latest $hashtag$ $hashtag$ in $hashtag$ !!
TwistandSports,bocce. burgers. beer. $hashtag$
prudenciolegaza,extremely amazing auction
LyteFX_,motion design and graphics
HMIbuzzOfficial,hmi buzz is a multimedia company dedicated to document the haitian american e$smiley$erience.
CricketCareers,follow us for the latest updates on $hashtag$ opportunities at $hashtag$. for additional details on working at cricket visit our website: $url$c
BestBuySupport,have questions about $mention$? need support? let us know! we're here to help $number$x7.
bestbitesblog,food and dining tweets from $url$ best bites blog.
EvntsPromo,want help with promoting your event/venue or even a music release on twitter & facebook? well look no further. please email jay$mention$.co.uk for more info.
marinrancul,extremely awesome offers
le_millionaire,"innovative ways to earn and make money through online internet marketing! global lotteries, money market and foreign exchange market trading."
317TeamIndy,follow $hashtag$ for info about events local music & local business deals. interested in social media marketing? email teamindy317$mention$.com for more info.
retailsalesjobs,hottest retail sales job opening leads - updated every $number$ minutes from major cities
pride_purple,"louisville public schools, home of the lions, roaring to excellence, preparing students for their future."
NewsFromTheSky,the largest multilingual collection of real-time aviation news.
PesadeliBot,bot for $mention$ | tweet randomizer
DigitalMumsHQ,we match businesses that need help with their social media with mums trained to be social media managers. as featured in the guardian & mailonline.
MP3AzUK,tweet $url$ mp3 best sellers and new releases by genres. this is a participant in the amazon eu associates programme.
EchoPressBooks,publishing original work and authors' guilty pleasures...
DataFlowLabs,mit data science start-up developing advanced analytics based on intuitive data-flow technology
andrademoctezu4,highly imposing review
godtributes,bot that posts tributes befitting each god! by $mention$. banner by $mention$. powered by $mention$.
ronzonipasta,ronzoni is a leading pasta brand providing healthy meals for the entire family.
Venue578,"downtown orlando's premier nightclub, entertainment complex, and music venue for over $number$ years (formerly named firestone live). tweet us for info on our shows."
bbhNYC,buzzbuzzhome is improving the way people search for new construction homes. queen bee: $mention$
RONAinc,"rona is the largest canadian distributor and retailer of hardware, home renovation and gardening products. $hashtag$"
RockAveRecords,"in $number$,ceo & founder louis espinoza, came back not as a musician, but as a musician an a record label for musicians. rock avenue records usa was created."
GlobalGlory3,we are set to raise up the man of his glory.
DCDouchbag,i'll snatch your girl if your trippin' she's on my line like i'm fishing. snapchat: dcd13
ScomAviation,"scom aviation specialises in recruiting highly skilled aviation and aerospace professionals for aviation jobs within design, maintenance and repair"
ge2015bot,tweets relating to the $hashtag$ general election $number$
3DSReddit,$number$ds news from reddit.
visit_benicia,visit benicia - a great day by the bay
JonellChamness,"we are the no. $number$ world fastest growing seo , small & big job services for buyer & seller to meet"
Primeonly27,primeonly27 online surplus electronics power adapters computer parts lasers optics industrial controls & some beekeeping supplies new us seller
riestraleoncio,highly plusher deals
herphomes,reptile lovers & owners! custom and handmade decor for your reptiles. check out our etsy shop & message us is you have any questions or to order
freebitcoins4u2,get free bitcoins at: $url$ btc faucets
TrainingMindful,"charles a. francis, $hashtag$ teacher, huffpost blogger, author of mindfulness meditation made simple: your guide to finding true inner peace. $hashtag$ $hashtag$"
LeeLambchop,$mention$ $hashtag$ $number$/2/14. $hashtag$ $number$/5/15. ranked $number$th in uk. _____ reviews online. $hashtag$ & $hashtag$ host. as seen on $mention$
loveahappyend,"loveahappyending lifestyle magazine! contributors from the uk, us and canada $hashtag$"
DebnHairGornal,deb n hair salon - award winning hairdressing. loreal colour trophy regional final winner $number$. stylist - rikki theodosi. instagram - rikkitheodosi
SharmarkeAhmed4,sorry about the lame username
CBoC_Events,"updates and news on upcoming events from the $mention$. we live tweet during our events, too!"
johnstownhawks,the johnstown tomahawks are a junior hockey organization and proud member of the north american hockey league.
thebeeofficial,"lancashire's more music station - $number$fm in chorley, $number$fm in preston & south ribble, $number$fm in blackburn, darwen & hyndburn. snapchat: thebeeradio"
StPancrasInt,the official account for st pancras international - a destination station | transport | dining | shopping | arts & culture
theFINND,"crowdsourcing $hashtag$! the finnd connects fed govt., industry & academia to solve hard problems & overcome obstacles in the contracting process."
kubidyza,personal assistant & website admin of $mention$ || crazy love || bae's favorite
FlHospVF,"with five hospitals, florida hospital is the largest hospital system serving volusia and flagler county residents."
GovWin,delteks govwin solutions are designed specifically for govt contractors aiming to grow their business and win more contracts.
operationcatnip,humanely reducing the cat population via tnr & serving as a model and mentor for other communities with the vision of ending the euthanasia of cats in shelters.
RiverCityMC,twitter page for the missional communities at river city church.
IBMSystems,ibm systems is middleware & hardware built for today's digital economy. follows ibm social computing guidelines. maintained by $mention$ & $mention$.
Be_Xfitness,never work out alone
LifeAtPurdue,the official twitter account of purdue university.
subredditsbot,this account is trying to keep track of everything that happens in the popular subreddits on reddit. this is a bit and simply posts what others post on reddit.
WSRArecycle,"wsra is an association of recycling professionals that works to e$smiley$and the knowledge, enhance the skills, and advance the careers of our members."
RunningChics,"i am simple, my running chics line is simple, and i like life to be simple. after all, life is a race--be comfortable!"
ThePopZone,a friendly and exciting pop music forum to discuss pop music and culture. join today and get access to free downloads and more!
ge2015bot,tweets relating to the $hashtag$ general election $number$
etailPR,"specialising in digital pr, affiliate marketing & brand collaborations. follow us on instagram: $url$"
Rombaart,i do graphics mostly when im bored and when im not playing or watching streamerino. $number$ yo scandinavian.
DestinyRDT,destiny the game news from reddit.
localsexdating,find $hashtag$ $hashtag$ for $hashtag$ sex or have a discreet $hashtag$ $number$+
donorhut,"$hashtag$ makes $hashtag$ easy and best of all, it's $hashtag$! safely and securely accept $hashtag$ online directly into your bank account."
LyricBelfast,award-winning producing theatre in belfast. this month... conor mcpherson's $hashtag$ (6 - $number$ oct)
TheOffer,"|| hard rock band from the gulf coast, usa || new adrift e.p. out soon!"
BigEarsFestival,"offering artists and audiences unprecedented opportunities for artistic e$smiley$loration & collaboration | big ears returns march $number$ - april $number$, $number$."
947Star,youngstown/warren urban radio station
intermtnsports,"intermountain region sports. i comment on sociopolitical issues, but dislike the major parties. veteran, advocate for reform of the $hashtag$ $hashtag$ $hashtag$"
TheRealDogecoin,"dogecoin (/do_kn/ dohjkoyn, code: doge, symbol: and d), is a litecoin-derived cryptocurrency featuring a shiba inu from the doge internet meme."
CEHealthCareers,ce health careers connects exceptional nurses with excellent hospitals!
SimcoeRedcoats,official twitter page for governor simcoe secondary school! follow us and always be informed about redcoats news and upcoming events! who's house?
northernrailorg,official twitter of northern rail train services. monday - saturday $number$:00-22:00 sunday $number$:00 - $number$:00
CushWakeUS,"cushman & wakefield is a global leader in commercial real estate services, helping clients transform the way people work, shop, and live. $hashtag$"
TheAppleForest,sometimes you can see the forest for the trees!
AndresNewsStand,"in the same location since $number$. daily racing forms, magazines,sports tip sheets and much more. comebyandsaurus"
AFlyswatter,these are flyswatters
Dem5SOS_Updates,is it hi or hey? || turn our notifs on! || kings and the queens of the new broken scene || we love our followers! || access to $number$/4 || our info below! ||
BrandsKingdom,shop with us from $hashtag$ and get guaranteed rebate up to $number$%. for customer support and assistance contact $mention$ $hashtag$ .
MoM_Mastering,$hashtag$ mastering gives artist's a competitive rate for $hashtag$ $hashtag$ $hashtag$! mom also loves current events $hashtag$ $hashtag$!
TotalLacrosse,usa's lacrosse store! follow us: instagram $mention$ - $url$ - $url$u
naysayermdzvyt4,hey fans where are the top places to eat in america? vote for internet fans favorite fast food restaurant at our link and get a gift card on us!
seansramblings,a pittsburgher living in the dc area. i also write a blog that is occasionally pretty good.
BostonRDT,boston news from reddit.
_LHS_Leadership,"official twitter account of lansing high school leadership, managed by leadership students. follow for information on events and spirit days! $hashtag$"
TheAppleForest,sometimes you can see the forest for the trees!
DellCares,"dell's social media $number$x7 global support team. we're here to listen, help & provide proactive info to our customers. order status: $url$"
kgon,portland's classic rock station
tmj_cao_hrta,"follow this account for geo-targeted hospitality/restaurant/tourism job tweets in orange county, ca from tweetmyjobs. need help? tweet us at $mention$!"
Startup_Canada,startup canada is canada's grassroots startup movement. join us for $hashtag$ every wed & fri $number$pm et hosted by $mention$ & $mention$
MsBetsyRoss,the federal govt is out of control! we need a convention of states-sign the petition $mention$ $url$ $hashtag$ $hashtag$
