MrViralMarketer,$hashtag$ $hashtag$ $hashtag$ $hashtag$ $hashtag$ $hashtag$ $hashtag$ $hashtag$ $hashtag$ $hashtag$ $hashtag$ $hashtag$ $hashtag$
SextraBad,did you manage to get to level $number$ before having an e$smiley$losive orgasm? the higher levels contain advanced sex positions and interesting masturbation techniques.
NDSUathletics,official account of the north dakota state bison. $hashtag$
tpmquiz,"questions and answers from the world of philosophy, curated by the philosophers' magazine. questions and comments to $mention$."
DjSix7Even,"planet $number$ official resident dj bookings : _: $number$ $smiley$jsix7even$mention$.com, facebook$smiley$jsix7even, i.g: $mention$ $hashtag$"
GroundTruth,training and supporting the next generation of foreign correspondents.
ARwoodartist,specialize in making wood art on the scrollsaw. can make wood portrait from photo
SyntaxiousTM,current xenoncraft network owner | plugin developer | $mention$ trainee | $url$ port: $number$
Camswr_erf,deals
TweetYourBooks,"readers & authors we're the $hashtag$ $hashtag$ team & fanfare great books to a select audience of $number$,000 tweeps! $number$m impressions per day! sister to $mention$"
FreelanceWJ,number one online community for freelance writers
NewLookHelp,"we're here to help & will get back to you within the hour. we're open: $number$am $number$pm monday - saturday & $number$am - $number$pm sundays on twitter, facebook & chat. $hashtag$"
ClarkDems,official twitter page for clark county (nevada) democratic party.
raidboss_ebooks,"suffer, mortals, as your pathetic magic betrays you!"
TotalTrafficBNA,local nashville traffic info powered by total traffic + weather network.
ODonnellsBread,"we are an artisan bakery based in killorglin. we produce traditional and contemporary breads, gourmet stuffings, muesli & $hashtag$. blas na heireann silver $number$"
JSSMedical,"a leading cro providing full range of clinical research services to global pharmaceutical, biotech and device companies"
seputartradings,analisa anda lah yang paling benar!. sebuah visi untuk membangun dan membantu trader agar sukses & mandiri. pin bb $number$d9f5b. klik $url$1
Dem5SOS_Updates,is it hi or hey? || turn our notifs on! || kings and the queens of the new broken scene || we love our followers! || access to $number$/4 || our info below! || mgc/4
BeatriceHartzog,"if you have any questions about islam and would like to find answers all you have to do is visit our site, and chat with us :"
MC_Toastmasters,improve your public speaking and leadership skills! we meet every wednesday at $number$:15pm in hancock $number$. anyone from the marist community is welcome!
yskPhoenix,"follow ysk phoenix for the latest news in the $hashtag$, $hashtag$ area. $url$"
hipazojajej,hi there! i update funny facts and news everyday. if you want to read more please visit my website.
cloudpsi,cloud computing news and information.
Ilusional_COD,cod team
OSTtalk,making you think twice. news + convos hosted by $mention$. on-air $number$-10am et on $mention$ and streaming online at $url$9. call: $number$-500-9457
TheOtherPlus1,socially inept. rather awkward - like in turtle. if you cant find anything good to say then say nothing - i struggle...
LethbridgeSport,"lethbridge sport council..a voice for sport. $number$-stop shop for sport resources: we promote the development of sport, attract sport events, & assist sport groups."
NYTSports,"breaking news, analysis and live updates from the sports e$smiley$erts of the new york times. find us on instagram: $url$"
anotao_news,top news published $url$ $url$2 $url$ $url$
Justfabzz,celebrities daily pictures
tmj_il_health,follow this account for geo-targeted healthcare job tweets in illinois non-metro from tweetmyjobs. need help? tweet us at $mention$!
poolplayers,official twitter channel of the american poolplayers association (apa). we're the world's largest amateur pool league!
_Bible_Verse,"bible verses that reveal the beauty of fenton, moffatt and other bible translations. brighten your day with a verse or two!"
FashListings,"sell fashion? list your business for free in our website directory, $url$"
Ace_Tennis_Tips,"tips are now on $mention$, if you would like to join for $number$ a year, please email acetennistipsvip$mention$.com $url$"
ClubNedCafe,"we are the first legal cannabis cafe! we promote the adult use of cannabis, a wonderful plant! facebook:clubnedcafe, massroots:clubned"
macyshourlyjobs,"no matter what you're looking for, there's a job to excite and inspire you at macy's. discover the many career opportunities waiting for you at macy's today!"
gatorschomp1019,apr-00
N_H_Australia,hi we hope to help your company with getting some extra attention by creating a newshitteraustralia greetings your newshitterteam(holland)
LushWeCare,the uk customer care team $mention$ - here to answer your questions and chat all things lush
ThePumpAndDump,"a parentally incorrect comedy show and night out, for once. follow all our tweets over at $mention$. instagram: $mention$ $hashtag$"
hipazojajej,hi there! i update funny facts and news everyday. if you want to read more please visit my website.
QuestionAll7,sharing videos from various alternative media sources. $hashtag$ is king e$smiley$ing the $hashtag$ beast system. $hashtag$ $hashtag$ $hashtag$
StockExpert3,stock e$smiley$ert
nicksgc,our $number$ acre garden center has everything for your landscaping and gardening needs. just east of denver in aurora. visit or call us today! $number$-696-6657
edgsalass,highly prodigious product
HeretoHelpBC,we are seven bc organizations working together to help people better prevent and manage mental health and substance use problems and live a healthier lives.
mahdavia,*dedicated to spread the true message of islam i.e. universal brotherhood and peace.
OrganicTrade,the organic trade association (ota) is the membership-based business association for organic agriculture and products in north america.
roch_samaritans,"sorry, we cannot offer emotional support over twitter. please ring for free $number$ $number$ or email jo$mention$.org. text rods24 $number$ to $number$ to donate"
Allie_Mashmusic,afro-deep/deep house/commerial unsigned duo dj/producers music is an art work. $hashtag$ united africa.
3CountThursday,pro wrestling podcast live thurs $mention$ $number$:30p et. available $number$/7 at $url$ & $url$. $mention$ preshow hosts
weeddream420,nsfw! must be $number$. adult content! post are not all mine. i like sexy stuff and beautiful women! i am a dude! no dick pics.
SportsNewsBTS,"all things sports, news, vines, and debates. follow and we'll follow back! $hashtag$ $hashtag$ $hashtag$ $hashtag$"
betterlivindex,"sydney, coffee, food, art and travel. published by dennis lindsay"
hopburnsblack,"the hop=craft beer, burns=hot sauce, black=records. also: cider, wine, good times. shop + tasting room in peckham rye/east dulwich, $number$ east dulwich rd, se22 $number$ax"
ultimateoffer,$hashtag$ products & services | $hashtag$ $hashtag$ $hashtag$ | $url$
trackingpaws,"it's sad when we have lost a pet, and we shouldn't like our missing pets to end up being tormented in a laboratory. we shall remember this cruelty:"
55002koyli,"a non for profit organisation renovating the $number$ koyli deltic engine relying on your contributions, to make this happen."
Info24US,"breaking, world, us and local news"
byZayys,$hashtag$
dronesweetie,"its a bird, its a plane...it's images of drones, as described by a computer. powered by $url$ & rebecca lieberman aka $mention$"
LIVESTOCKcanada,canada's premiere lifestyle boutique $url$
BankingLaw,"latest legal and regulatory developments in financial services. covers: sec, dodd-frank, cfpb, compliance, finra, the eu, other banking matters. a $mention$ feed"
GodfreyB2B,godfrey is one of the largest b2b marketing agencies in the united states. we help industrial manufacturers market themselves more effectively.
Camswr_erf,deals
sweetwaterbrew,"housed in atlanta, headiest brews this side of the rockies. available anywhere the fishing is good up the east coast. gotta be $number$+ to follow."
csoundzradio,"the hottest hip-hop,old school reggae,soca and dancehall music selection in the world tune in now and turn up!!!!! (worldwide radio)"
TheAudmanMedia,"an urban news, basketball and hip hop media brand! check out $mention$ for your $hashtag$ fix exclusively on $mention$ $hashtag$"
EconBritain,follow for news on britain from the economist.
poor2016,_ _ * kik$smiley$r0101
ActivityToronto,$hashtag$ and $hashtag$ in $hashtag$ and $hashtag$ ( from $hashtag$ and $hashtag$ media) $hashtag$ in canada $hashtag$ in canada _
casandromart,unbelievable product
FWSullivans,"f.w. sullivan's fan bar & grille located at $number$ w. main st. in richmond, va. award winning cuisine and nightlife. see you at sully's!"
NOFAVT,"growing local farms, healthy food, & strong communities in vermont!"
Camswr_erf,deals
Bizzler4,$hashtag$ $hashtag$
favhouse,"your daily source for home decor inspiration. discover thousands of cute decorating ideas, and shop for items you love _"
LitChat,"litchat is for book lovers, readers & writers. $number$-hour $hashtag$ occurs m & w, $number$ pm/et. $hashtag$ hashtag established january $number$ by $mention$."
NewsWatch_99,"newswatch $number$ is a live, student-run newscast. we provide news for ole miss, oxford and lafayette county. we air monday through friday at $number$ p.m."
bcfc_fans_fc,we are bristol city london supporters fc. division $number$ of the london supporters league. we were formed in $number$. london based reds get in touch. coyr $hashtag$
tarawolfchakra,tara wolf zodiac and chakra jewellery. styled for you. worn for wellbeing. choose your statement of soulful style today.
PAWSofCoronado,paws of coronado advocates for the animals residing in the coronado acf and facilitates the adoption of these animals thus insuring their safety and well being.
futuresagency,"run by $hashtag$ aka $mention$ tfa comprises $number$+ futurists, globally. we do keynotes, presos, future trainings. it wasn't raining when noah built the ark!"
wrnjradio,"your local station - $number$ am, $number$ fm & $number$ fm. serving warren, morris, and sussex counties since $number$. follows and rts endorsements."
keepingkarlsson,"fantasy hockey podcast with an analytics bent. informative, self-aware, occasionally prop(at)hetic. hosted by $mention$ and $mention$. $url$9."
lovelittlelush,a posh baby boutique specializing in couture apparel & accessories for your little lush girl or boy. shop our chic collections guaranteed 'crafted with love'.
RadioBobiko,"radio bobiko und blickpunkt bobiko - euer regionales webradio und kulturmagazin f_r die region bonn bis koblenz und westerwald, rlp, nrw und hessen."
ChristineCleek,"fort walton beach/emerald coast real estate broker professional specializing in $number$st time homebuyers, short sales, foreclosures and military relocation."
mountainbuggy,"from newborn to toddler, the mountain trails to the city streets - mountain buggy enables parents to live a life without limit."
CottageOckman,stylish accommodation in a beautiful $number$ bedroom cottage with open plan living. perfect for that special break. ockmancottage$mention$.co.uk
Synix__,"survival games player, sky wars fanatic, youtuber and a ugly person."
R_Meditation,meditation news from reddit
__J_L_M__,"reflective prodigal sunlightvoltron anagrammatic feeds, retweets, follows and/or favorites do not equate to endorsements... but sometimes they do... lol"
SouthwestAir,we run on $hashtag$. follow for news & stories about the greatest employees & customers in the world. for official concerns please use the link provided.
contriteshadow,"likes: motorbikes, nerf, writing/reading fanfic , ferrets & other animals, gaming, veggie cuisine, old movies & crime shows. dislikes: prejudice & cruelty."
BonesDobie,a $hashtag$ doberman fur fag here to mess things up.
MyAlliesTrading,myallies delivers breaking news from across the globe and information on the latest breaking business and financial events. $url$
FYSuccess,dedicated to making sure that your first year at salem state university is a successful one!
Shim_bop,the most effective way to destroy people is to deny & obliterate their own understanding of their history: george orwell. views belong to me rt's everybody else
brodigan,i'm a mountain of obscure $number$s references & a ton of other super inappropriate bullshit that's intended as life lessons.
samsBellabob,"i grew up in racing kennels but didn't fancy it much, i wanted to be a pet and be cuddled instead.mascot of $mention$.lover of sausages. sister to charlie"
Nixonsloungechr,increasingly rare conservative views in california - from a chair that has seen it all. not officially an extension of richard ni$smiley$n. duh
ovrld,"ovrld is your guide to the best music from, in, and around the live music capital of the world - austin, texas. header photo by $mention$"
Adlez27,"lofe || $number$ || nb (they/them) || i like vocal synths, video games, music, rp, and linguistics"
novandogiantino,always motivated
ocoeegt,"connecting people to god, to one another, the marketplace and to the world..."
MyAlliesTrading,myallies delivers breaking news from across the globe and information on the latest breaking business and financial events. $url$
sthelenstownfc,official twitter feed of st helens town afc like our facebook page $mention$ $url$2. main sponsors $mention$
ShortAndCrunch,musik-band
GilmoreGuysShow,gilmore guys is a podcast in which $mention$ & $mention$ watch every single episode of gilmore girls and gab about 'em. available on itunes / soundcloud
earths_choice,helping the earth one choice at a time!
Noles247,the most comprehensive source for $hashtag$ $hashtag$ athletics on the web. part of the $url$ network. $hashtag$
casandromart,unbelievable product
Sale_Fox,"girls spend hours deciding what to wear, and all guys do is try to picture us naked. follow me - i follow back!!!"
euro2016guide,"everything you need ahead of the $hashtag$ tournament. tickets, travel, team news & competitions. the premier resource for euro $number$ made by fans!"
dukeo,"entrepreneur making money online one step at a time. follow me if you want to learn about seo, internet marketing, blogging, entrepreneurship..."
CleanClassicCar,"we are south west florida's leader in clean classic, muscle, antique and e$smiley$tic cars. we sell worldwide and can arrange shipping for you. call us $number$-355-1955"
games_24_365,searching for games......
euro2016guide,"everything you need ahead of the $hashtag$ tournament. tickets, travel, team news & competitions. the premier resource for euro $number$ made by fans!"
planeondaroof,"heathrow resident with less rights than a mushroom! fed up with man's inhumanity to man, inequality,greed, & indifference to others' basic needs."
Mathematics1001,"buy mathematics workbooks $url$ printable math worksheets for addition, subtraction, multiplication, division"
FlavourCrusader,"we're farmers, gardeners, cooks and eaters fighting for a healthy, fair and delicious food supply. join us."
ReikiAnimalHeal,reiki level $number$ practitioner. as i believe animals need healing as much as humans they are my passion. both in person or distance healing available
tweetatg,"bringing you the latest $hashtag$, $hashtag$ and $hashtag$-to's"
Camswr_erf,deals
CampCanineInc,"camp canine, inc. is a luxury dog daycare and boarding facility in ashland, ma. camp canine, inc. boasts some of the largest outdoor play space in ma! web cams!"
waplrocks,"$number$ wapl, wisconsin's rock station. streaming live at $url$"
BellevueHilton,"located in seattle's upscale east-side, the hilton bellevue hotel is in the heart of beautiful bellevue, washington!"
HFT4u,"$hashtag$ from stretching, flexibility and $hashtag$ $hashtag$ to strength $hashtag$ and $hashtag$ $hashtag$.$url$2c"
acupunctureyuma,acupuncture and wellness center in the desert southwest.
favhouse,"your daily source for home decor inspiration. discover thousands of cute decorating ideas, and shop for items you love _"
TheUpperValley,"locally sourced, organically grown"
MatchmakerPost,the matchmaker post is canada's only online matchmaker magazine from select introductions
WinBetaDotOrg,"we provide late-breaking microsoft news and we've been doing it since $number$. we offer news on windows, xbox, surface, windows phone, office, apps, and more."
60_and_stunning,visit $url$ to meet and fuck sexy gilfs in your area
AfterWinnersRT,"*get paid $number$ play games with sponsors* account managed by after winners, llc. social team. contact: social$mention$.com - $url$"
VJB_Live,live stream of music playing at $mention$ locations. we make background music more engaging.
EandM_News,bringing you the latest news and updates in the music and entertainment industry. follow this page for the latest.
startupcelebes,innovation of eastern indonesia | startupcelebes$mention$.com
LonelyOakradio,are you a singer or songwriter? upload your music. we'll play it on air the same day. we play rock. $url$ $url$
WhichUK,making consumers as powerful as the organisations they deal with.
NutritionGlobal,"your daily source for health, nutrition, fitness, & wellness information - exclusive interviews, natural health news, product reviews, and more."
TriSportWorld,"$url$1 is the largest online triathlon club, running club and biking club finder. search our site to find your specific type of club."
EaganPolice,for police assistance call $number$
OutThereShrops,"promotional marketing solutions for leisure, tourism, hospitality and lifestyle businesses $hashtag$ $hashtag$ $hashtag$ $hashtag$ $hashtag$ $hashtag$ $hashtag$ $hashtag$ $hashtag$"
WyoRadio,"a radio station group which includes $number$ kmrz, $number$ kqsw, $number$ ksit and $number$ krkk"
CardiffBizTweet,$hashtag$ $hashtag$ & $hashtag$ $hashtag$ $hashtag$ $hashtag$ $hashtag$ & $hashtag$ via $hashtag$ $hashtag$ $hashtag$ use my $mention$ $mention$ & $hashtag$ $number$ $hashtag$
CheerNewYork,cheer ny is a non-profit cheerleading charity made up of adults. our mission is to help the community and local charities!
SaltCreekCN,i write for corn nation on the sb nation network about nebraska sports. i'm also a phd student in microbiology. opinions not shared by my employers.
StockPVD,"thoughtfully sourced, well-designed kitchen tools, cooking resources and gifts for food lovers. join us for demos & tastings, or just come in to talk stock."
_Handy_Apps,little apps that make your life easier. pequeas aplicaciones tiles para hacerte la vida mas sencilla. $hashtag$ $hashtag$ $hashtag$ $hashtag$ $hashtag$ $hashtag$
KathNielsGlobal,"warning: we tweet a lot! one love for kathniel. fair, equal and fearless. supporting them as loveteam and individually. || $mention$ $mention$"
tmj_la_eng,follow this account for geo-targeted engineering job tweets in louisiana non-metro from tweetmyjobs. need help? tweet us at $mention$!
OximityLaborRts,news about labor rights. oximity delivers substantive news directly from organizations & individuals worldwide.
Questogood,insane in the membrane osrs gainz! you want the youtubes? $url$ you want the twitch? $url$ keep making those gainz!
customsclub,customsclub promotes models & pornstars who make custom videos & fetish clips from your script! order yours at $url$
BibleUplifting,loving god and loving you! all is welcome!! praise god! god is good all the time!
sonething_news,"world, tech, business, sports, politics and entertainment news"
news24extra,"news, politics, entertainment, sports, interviews, fashion, religion, etc"
favhouse,"your daily source for home decor inspiration. discover thousands of cute decorating ideas, and shop for items you love _"
ClubNedCafe,"we are the first legal cannabis cafe! we promote the adult use of cannabis, a wonderful plant! facebook:clubnedcafe, massroots:clubned"
NightOwlsGaming,"founder of the night owls gaming community, youtuber & official warframe fan channel"
Khamashuridze,"collection of daily news on nato & security-related topics (eng, deu, fra, rus)"
RadioColegial,"emisora de radio (v_a internet) manejada por estudiantes en la universidad de puerto rico-recinto de mayag_ez, con un enfoque en la comunidad universitaria"
94heskind,secret little rendezvous
NewGreenStuff,"trend spotter: breaking the latest green inventions, ideas & news $number$/7"
beautycrib_tv,"beautycribtv was designed to appreciate beauty in all its ramification. from beautiful works of art,to places, events, news, life style, sport etc"
DARTMOUTHHH,"select your self-catering accommodation in dartmouth from our choice of luxury, exclusive houses, large and small cosy cottages and waterside apartments."
hiwearespiders,hi! we are spiders. we are everywhere. we are very misunderstood. can we have a hug? we didn't think so.
NSABing,binghamton university's only broadway a cappella group
RedditComputing,computing news from reddit
treadcomics,the official twitter account of all things $hashtag$ and the stuff we are following
iDroid_Daily,making it easier to develop apps for the android platforms and iphone systems. learn how to develop game apps for both iphone and android. remember idroid!
IHOP,everything you about breakfast.
SofaDesign1,"designer and manufacturer of high quality furnishings. all enquiries welcome tel. $number$ $number$ $number$, today! truly bespoke, truly unique, truly yours!"
ProjectCoin,"e-mail team$mention$.org for bespoke opportunities. we're able to customise, filter & analyse data to suit your exact requirements"
Skipton_Police,skipton safer neighbourhood team in craven north yorkshire - dont use twitter to report crime or incidents. this page isnt monitored $number$/7. call $number$ or $number$
GistReel,| social media entrepreneur | pr & hype (event & brand) | contact :- gistreel$mention$.com
ChippysPopcorn,"makers of fresh, popped-on-site kettle corn, caramel glazed kettle corn, cheddar cheese corn and chippy's blend of all three. it's crazy good!!"
townsvilledaily,"the latest best fresh, townsville daily viral $url$c bnn.io and rite.io media co"
WJBF,coverage you can count on from wjbf news channel $number$ augusta-aiken. the csra's home for local news and abc-tv. rts do not mean endorsement.
ArrakisSpiceUK,"yorkshire based socialist shop, travelling the galaxy to trade in melanje and other edible delights. we believe in sustainability and the progressive left wing"
busboysandpoets,"busboys and poets is a restaurant, bookstore and cultural hub where art, politics and culture intentionally collide."
phoenixworldent,"film sales agent | production company | distributor - posts about phoenix, films and the industry - sometimes all three. click website link for library."
MusicAreUsBlog,"your $hashtag$ source for news, album reviews, editorials & new music from your fave pop, hip hop & rock artist!!! .. we love music so much we have to report about it!"
Hamilton_STC,start the cycle. a non-profit program working with libraries so anyone can check out a bike like you would check out a book.
physiciansnews,"news for doctors, patients and everyone with health."
WelshBizEvents,$hashtag$ $hashtag$ $hashtag$ promotion services from $mention$ -$hashtag$ $hashtag$ $hashtag$ $hashtag$ & $hashtag$ $hashtag$ in $hashtag$ $hashtag$ $hashtag$ $hashtag$
SpankysCHNC,serving chapel hill since $number$
QeenWoodes,hot deals
DillonSteen,"steen promotions, a division of steen entertainment, is a company dedicated to providing quality radio promotions to artists in the texas country genre. we inte"
chooseabroker,keep more of your profits when trading
Fantasy_Wired,"all things daily fantasy sports. news, analysis, rankings, reviews, picks and strategy tips for mlb, nba, nhl, nfl, and golf. $hashtag$"
6ONE9CLOTHING,custom one of a kind san diego made and designed clothing...it's a diehard thing.
DCRPoker,poker room at downstream casino resort
AspireAcademy,empowering coaching for horse owners and non-owners. for dreamers & hard workers! tweets by wiola. blog: $url$
UnivUtahFans,breaking news about the university of utah.
olu_tayormi,"entrepreneur, internet marketing and blogger $url$ $hashtag$"
PRNmfg,heavy industry & manufacturing news from pr newswire.
SDtechsupport,"tech, qa, desktop support, technical support, computer technician"
pageAKB48,hello. follow us ^^
NAmerBearCenter,"north american bear center ely, minnesota $number$ $number$-365-7879"
NnennaYvonneC,the language church: the california dream tour musical $number$d animations series $hashtag$ llc $hashtag$
xJurastic,"designer for $mention$! former astral $number$k, outlet .2k, edk, $number$k, sentra $number$k, hyraid $number$k, e$smiley$nic .6k members."
roomjunkiechat,"love your home? join us for $hashtag$ every monday from $number$pm to $number$pm.answering questions, tips, trends & inspiration. hosted by anne tuohy $mention$"
RiverCityTap,"river city tap + grille is where folks from lawrenceburg, in come to kick back with a cold drink and tasty meal. come in today for a great e$smiley$erience!"
troubl0573,the official twitter of $url$
ERrisk,$hashtag$ $hashtag$ and $hashtag$ preparedness. regular $hashtag$ and links to safe sites. i try for a $hashtag$
IUCampusMin,"iu campus ministry will help you to_nurture your faith and spirituality, engage in service, and promote community and fellowship"
trackingpaws,"it's sad when we have lost a pet, and we shouldn't like our missing pets to end up being tormented in a laboratory. we shall remember this cruelty:"
WVUMSports,"the student radio home of canes sports, broadcasting live on $number$ fm in south florida and $url$ worldwide. directed by $mention$."
TRideArborist,arborist services is a dedicated group of isa certified arborists. we climb all the trees we work in. we love trees and maintain the largest trees in the region
extrasocial1,social media marketing and pr news
