Marketrobots,"bonds, briefly, commodities, economy, forex, stocks * _________. ________. __________. ______________. ________. __________ _______, __________ ___________. $hashtag$"
Warriors3MI,"warriors $number$ comics & games is located at $number$ michigan ave (westbound) in wayne, mi. we have weekly promotions and tournaments, call $number$-895-9069 for more info."
TheBIF,"r&d new business models to transform complex social systems like education, healthcare and government. dig into the $url$"
AboutSepsis,providing information to increase awareness and earlier detection of sepsis. presented by thermo fisher scientific
Israelite_Vibez,"$number$ west isupk, the home of the truth"
thelumberjac,lifestyle and gear guide cut for the modern mountain man.
AnglosearchNews,"news from the guardian, daily mail bbc london uk britain & around the world. updated every $number$ minutes."
aSEATaxiCab,"a cab that loves seattle, knows lots of great sports. tweets about seattle. part of a cab group (building in progress)."
MilMomTalkRadio,"militarymomtalkradio: $hashtag$ $hashtag$, $hashtag$, $hashtag$, $hashtag$ $hashtag$, $hashtag$, $hashtag$, $hashtag$ and $hashtag$ for the $hashtag$ $hashtag$."
411wrestling,"wrestling news, show reviews/recaps, columns, & more! covering wwe, nxt, roh, tna, lucha underground, evolve, njpw and all other things wrestling!"
HumberToday,"follow us for the latest news, events and more from humber college."
AgnezMoFC_ID,"official twitter fanbase of agnes monica fans | we love $mention$ |$hashtag$ dream,believe, and make it happen !!"
haptter,create $hashtag$ $hashtag$ & $hashtag$ $number$ your followers. here $hashtag$ $hashtag$ & $hashtag$. visit $url$ to know more on fb:$url$
Detox_n_Reboot,chris is a life/wellness coach specialising in mental emotional and physical growth. discover the root cause. our life is shaped by the decisions we make.
My_MetroBank,welcome to the official twitter handle for metro bank. we're committed to making life easier with amazing service & convenient hours $number$ days a week! member fdic
iROCK109,"internet radio's best classic rock station. live djs, $number$/7 requests, high-quality streams"
ebooks_chevaux,"ebook text, translated, kind of. $hashtag$ a $mention$ production."
317TeamIndy,follow $hashtag$ for info about events local music & local business deals. interested in social media marketing? email teamindy317$mention$.com for more info.
falconsbuzztap,the latest atlanta falcons buzz from buzztap.
IILGlobal,"improving organizational performance with intelligence, integrity and innovation. let us know you stopped by; use the code 'twitter' at checkout for $number$% off."
msuredhawks,montclair state university
breakingtonews,"curating the best media feeds in toronto. a city in $url$, a community service media network supporting civic causes and local arts"
BlackPearl_MSM,our mission is to provide our clients with professional bespoke $hashtag$ $hashtag$ services that will protect their interests from $hashtag$ and $hashtag$.
aSEATaxiCab,"a cab that loves seattle, knows lots of great sports. tweets about seattle. part of a cab group (building in progress)."
User1stDotCom,"web accessibility startup that helps ecommerce, government and academia websites drive better usabillity and ux. posts by $mention$"
MonsterConTX,"san antonio's best lil horror convention! free family event, four years running."
Rotary,"we are neighbors, community leaders and global citizens uniting for the common good. with you, we can accomplish even more."
Integro,"since $number$, an industry-recognized product and services company, specializing in solutions for email management, ediscovery, & records management."
Map_Game,"the map game is a free geography quiz based on google maps. no flash, no need to register, just start finding places on a blind map!"
MyAlliesTrading,myallies delivers breaking news from across the globe and information on the latest breaking business and financial events. $url$
IntrepidTheatre,"purveyors of quality indie theatre since $number$, producers of victoria fringe, uno fest & outstages, the metro studio & intrepid theatre club. $hashtag$ $hashtag$"
DY_IO_23,read this book
RCA_Academy,an international prep school established in $number$ with locations in new england and upstate new york
Startup124,model for talented and motivated $hashtag$. $mention$: $url$ $mention$:$url$ $mention$: $url$
aSEATaxiCab,"a cab that loves seattle, knows lots of great sports. tweets about seattle. part of a cab group (building in progress)."
Sportingstables,reading between the lines in life. monitoring nfl/nba/horseracing since $number$ very closely. deep respect for sports talk radio. respect good hearted people.
BarbieBitchNM,stan for da queen - saw her in concert $number$/21/12 - $number$/08/15 - rt'd me $number$/18/12 - $number$/05/13 | badged x4 | oscar follows
Good_Life_Group,"a dynamic real estate group on lake lanier, specializing in lake and luxury homes alike. give us a call ...when you're ready for the good life!"
Africa_Gossip,africa's number $number$ gossip news website.
RadioNetHawaii,best talk radio hawaii
AuxEpices,"aux epices is a cozy malaysian-french bistro located at $number$ baxter street, right off of chinatown & little italy, specializing in healthy, tasty, natural food!"
TFDWofficial,tennessee democratic women united to support the democrat party
RoryTDC,setting brushfires of freedom in the minds of men
KSBDCBIM,business in motion making business e$smiley$ansion easier contact the wichita state university kansas small business development center at $number$-978-3193.
wsuksbdc,free consultation. affordable training. providing kansas entrepreneurs support & resources to grow their businesses.
POLSStLouis,the most important news about politics and $hashtag$ in st. louis
02131gnlb,weather for $number$
ColonialBicycle,"locally-owned and operated bike shops in portsmouth, nh and salem, nh. live free and ride!"
3345Live,$hashtag$ hiphop and r&b classics brought back to the forefront of listening music pleasure. get the new app $number$ live in the app store and google play store.
classic_chevy,"i'm hagen durant, general manager of classic chevrolet - $hashtag$ volume chevy dealer in the world. tweets on $url$, chevrolet, automotive, & life.."
Buzz_Spot,"buzz spot the best service oriented business you never have ever had the pleasure to deal with. the product line actually speaks for itself,"
ravenationmusic,two young djs & producers. our musical roots come from $hashtag$ $hashtag$ $hashtag$ $hashtag$ | contact: ravenationmusic$mention$.com
Map_Game,"the map game is a free geography quiz based on google maps. no flash, no need to register, just start finding places on a blind map!"
TennTalkRadio,sandra beck $hashtag$ $hashtag$ $hashtag$ $hashtag$ $hashtag$ $hashtag$ $hashtag$
FLGM_AL_news,"we aggregate more nfl, mlb, and fantasy info in real-time than everyone else... combined."
EINMiningNews,latest mining news for mining industry professionals & analysts. mining industry today is a media monitoring service provided by ein news.
QueensLibrary,"enrich your life with lifelong learning, free books, information, education, culture and recreation at our libraries in queens, nyc."
inflamescrime,don't try this at home...
madsencycles,"euro-inspired family cargo bike. yes, it has a giant $number$ gallon bucket on the back, can hold $number$ kg (~600 lbs) of weight and is loads of fun! join the movement!"
RejoiceAmerica,"the only internet station that plays gospel hits from the past, the present and the future. $number$ rhythm of gospel internet station of the year..."
LibertyUnyieldi,"the natural progress of things is for liberty to yield and government to gain ground. thomas jefferson, $number$"
GHLgtbt,continuous price updates for greenhill & co (ghl)
KidsOf16,high school class of $number$ seniors twitter account!! advertising: lionsheadsocial$mention$.com
KatonaHamletHub,$hashtag$ $hashtag$ is a place to support our local $hashtag$. providing positive & encouraging messages to $hashtag$. share your story today!
PromoEvnts,want help with promoting your event/venue or even a music release on twitter & facebook? well look no further. please email jay$mention$.co.uk for more info!
Stockphoto3,we tweet about stock photography and stock video. get them at $url$ for images and $url$d for videos
Satellite_board,boulder's core skate and snowboard shop
stretchd,email: stretchdoeswork$mention$.com $hashtag$ ig: stretchdoeswork....focus-execute-finish..$hashtag$
LawScribes,legal affairs by $mention$ ba llb supreme court canada charter justice rights privacy citizenship constitution free speech criminal hot topics $hashtag$ $hashtag$
Map_Game,"the map game is a free geography quiz based on google maps. no flash, no need to register, just start finding places on a blind map!"
CapDemo,"we publish a weekly paper with news from orange city, alton, granville, hospers and maurice."
BoomersUltimate,"the place where baby boomers can come together to learn, share and grow a thriving business and vibrant life. $hashtag$ $hashtag$ $hashtag$ $hashtag$"
Primeonly27,primeonly27 online surplus electronics power adapters computer parts lasers optics industrial controls & some beekeeping supplies new us seller
CRVLgtbt,continuous price updates for corvel (crvl)
Photuts,sourcing and sharing the best and latest photography news from all over the web
clientspot,online project management and time tracking for creative teams - $url$
FlyersViews,philadelphia flyers fan page. not linked to official philadelphia flyers. $hashtag$ $hashtag$ $hashtag$ $hashtag$ $hashtag$ $hashtag$
aSEATaxiCab,"a cab that loves seattle, knows lots of great sports. tweets about seattle. part of a cab group (building in progress)."
libertytin,"k.s.b. international in india is the pioneer organization engaged in the manufacturing of premium quality watchmaking tools, jewelery tools, hobby tool"
RoloEdits,official twitter of roloedits $url$u
MTVBrasil,twitter oficial da mtv brasil. sky: $number$ | net: $number$/121 | gvt: $number$ | claro tv: $number$ | vivo tv: $number$/633 | oi tv: $number$/134 (hd). insta: $mention$ snapchat: mtvbrasil
Africa_Gossip,africa's number $number$ gossip news website.
CSISFood,the $mention$ global food security project aims to increase the dialogue surrounding challenges to food security and develop policy solutions to address them.
PodcastingGroup,sharing the very best of internet radio and $hashtag$ one tweet at a time. lessons in joyful living radio network
Map_Game,"the map game is a free geography quiz based on google maps. no flash, no need to register, just start finding places on a blind map!"
QueensLibrary,"enrich your life with lifelong learning, free books, information, education, culture and recreation at our libraries in queens, nyc."
CtrSocialPolicy,"our goal is to make sure children can learn, develop and thrive with the support of strong families, in safe and healthy communities."
PopKarma,popping with goodness at $number$ orchard street on the lower east side of nyc.
newsmls1,bringing you all the latest mls news from across the internet! $hashtag$
Croon4music,"croon4 provides four streamed stations of specially curated music and programming for seniors, without commercial interruption. its your music in a new way."
HEROgtbt,continuous price updates for hercules offshore (hero)
USATODAY,the latest news and most interesting stories from usa today. news that's meant to be shared.
LolaandPenelope,"an award winning premier pet boutique, spa, and wellness center located in clayton and town & country, missouri."
copiersolutions,sales and service of ricoh office equipment
The_Dude_Razor,"i'm the dude crazor. so that's what you'll call me. you know, that or, uh, his dudeness, or uh, duder, or maybe razor. streamer on twitch // hitbox // youtube."
CCBDeal,"sharing $hashtag$,$hashtag$,& $hashtag$ from websites, to help our followers and visitors find coolest $hashtag$. keep updated by flowing us $url$"
3Bladesio,$number$blades offers a cloud based development environment to build and share $hashtag$ projects.
RhodeIslandEMA,"prevention, preparedness, response, and recovery for rhode island governments and citizens. facebook: $url$"
affiliate11244,get latest affiliate marketing tricks and tips. start earn money using affiliate marketing. see more: $url$
fleetdjmangers,"managers of the fleet djs worldwide.. download the fleet dj app on all android, i phone and blackberry phones.. check out $url$"
_savedinthecity,a young adult women's ministry committed to sharing the love of christ to the world! $hashtag$
CUZgtbt,continuous price updates for cousins properties (cuz)
brewerpackaging,"with over $number$ years of beverage specific packaging e$smiley$erience, bev-pak is your trusted supply partner for custom printed products specific to craft brewing."
stilllife4life,still life for him & for her open on johnson street victoria & main street vancouver.
aSEATaxiCab,"a cab that loves seattle, knows lots of great sports. tweets about seattle. part of a cab group (building in progress)."
COOLinLowell,"working to make lowell a globally recognized center for creative activity. kerouac created here, you should too."
Amazing_Planet,highlighting the stunning beauties of our incredible planet.
wiml2,"jack of all trades, master of none."
01904gnlb,weather for $number$
RadissonBluAqua,unique. stylish. entirely radisson blu.
Media1Lessons,helping $hashtag$ and others navigate social media one tweet at a time. lessons in joyful living radio network
StorageStations,"$hashtag$ provider in $hashtag$, $hashtag$, $hashtag$ and $hashtag$"
Installite,"the sneaker shop of colorado $number$ pearl st, unit d, boulder, co mon-sat $number$-8pm, sun $number$-7pm $number$-440-3820 $hashtag$"
goodvibes_MT,delivering quality music therapy services throughout new york city. visit website for more info about services. follow on ig & fb: good vibes music therapy
The2019Seniors,original & official high school class of $number$ twitter account established $number$/12/2014 we're freshman now & seniors in $number$!!
KidsOf2018,official high school class of $number$ twitter account!! we're sophomores this year & seniors in $number$!!
CoIIegeBound,"high school is over, now what /// college, usa advertising: lionsheadsocial$mention$.com"
JuniataEagles,the official twitter of juniata college athletic department. fb: juniata eagles ig: juniataeagles
GoldOnion,"american? know your creator, recognized in founding documents, confirmed by the constitution. commonsense! i support and love israel."
wilkesathletics,wilkes university has $number$ ncaa division iii varsity athletic programs and is known as the colonels.
Science_Reddit,newest submissions from /r/science with original links.
aSEATaxiCab,"a cab that loves seattle, knows lots of great sports. tweets about seattle. part of a cab group (building in progress)."
1HCCA,the famous horley cricket club darts team!
UCLAAthletics,the official twitter account of the ucla athletic department. champions made here. $hashtag$
E9_UP_K8,read this book
austeragency,"architects of unique e$smiley$eriences. new york city's premier, full-service agency specializing in strategic marketing through public events."
Myrtle_NC,"updated myrtle beach news,sports, weather,entertainment,politics and business information."
affiliate11244,get latest affiliate marketing tricks and tips. start earn money using affiliate marketing. see more: $url$
EscapeVelo,"$hashtag$ supporter - visit christ centered gamer my pronouns are dude, dudebro, & cis scum."
allislandinsur,"long island car insurance, it is illegal to drive a vehicle that is not insured with some type of car insurance coverage."
LIJLRadio,lessons in joyful living radio is talk $hashtag$ / $hashtag$ for your life lessons. $url$
Brewery_Square,a vibrant new quarter in the heart of dorset's county town: brewery square re-defines dorchester as a shopping & leisure destination and a great place to live.
JanesVanity,fine european lingerie & feminine attire for the true connoisseur... from the voice of emily tate. shop online at $url$
Map_Game,"the map game is a free geography quiz based on google maps. no flash, no need to register, just start finding places on a blind map!"
WDWNTNow,find out what's going on now at walt disney world resort and disneyland resort.
keystomarketing,$hashtag$
Mondaq,"the latest thinking on legal, accounting, regulatory & commercial issues supplied by leading law firms & attorneys worldwide."
YBG_Spain,your goto partner $number$ business connections - global business built on partnerships $hashtag$ +44 $number$ $number$ $number$
ScorBoar,"sports news, blogs and tweets, voted on so you can waste your work day in the most efficient way. like us on fb $url$"
Postmates_Help,official customer support for $mention$
billboard,"your destination for the world's most popular music charts, news, videos, reviews & more. follow: $mention$ | $mention$ | $mention$"
TechFishNews,"your source for tech news, gadget views, and answers you can use."
SteamGameUpdate,keep updated with the latest steam game updates occurring among best sellers.
Fit88guru,"fitness trainer, workout, fitness enthusiast, fitness tips, fitness tweet the human body is the best picture of the human soul."
yskElPaso,"follow ysk el paso for the latest news in the $hashtag$, $hashtag$ area. $url$"
usafestival,the largest open event collector site of the states! hundreds of events in one place... more than $number$00 newsletter subscribers in one year!
FinanzCashFlow,"$hashtag$ your goto partner for all types of finance, investment & tax advice $hashtag$ $hashtag$ $hashtag$ $hashtag$ $hashtag$ $hashtag$ $hashtag$"
5MinTweets,^_^ tweet every $number$ minutes ^_^
The_IT_Nerd,a computer nerd that speaks english. i run a computer consulting company and i have a blog that speaks to and reviews everything from smartphones to cars.
therealKSCM,kscm is sacramento & rocklin ca's choice for college radio.
Map_Game,"the map game is a free geography quiz based on google maps. no flash, no need to register, just start finding places on a blind map!"
BlueRocVII,blueroc $number$ is a clothing and lifestyle brand influenced by high fashion and pop culture. we want our customers to not only wear the brand but indulge in it_
DoctorTweetz,"providing businesses, brands small and large the ability to reach their customers for more e$smiley$ure and profit! our reach is in the millions via twitter!"
100trains,the global $hashtag$ event of $number$. walking and rolling all over the world. $hashtag$ $hashtag$ and $hashtag$
vote41dbro,v o t e $mention$ $hashtag$ artist of the year
STLDPolitics,government & politics department of st. leonard's catholic school
a1_carinsurance,it is illegal to drive a vehicle that is not insured with some type of car insurance coverage
Mathematics1001,"buy mathematics workbooks $url$ printable math worksheets for addition, subtraction, multiplication, division"
YourBanRadio,your'ban - le nouveau son urbain. the new urban sound. all urban sound $number$/7. contact{at}$url$
CPLAgtbt,continuous price updates for capella education (cpla)
PlymouthSport,"bringing you the latest plymouth sport news straight from $mention$. providing local content to you $number$/7 in print, online, and through mobile."
miami_bikini6,miami bikini photos
Join_RAGE,"we are a grassroots association that work to address community issues, creates solutions & actively seeks ways to keep residents informed about englewood news."
BoombahInc,high quality sports apparel & equipment at low prices. an official sponsor for $mention$ & uniform sponsor for $mention$. facebook & instagram: $mention$
InstanttaxSoln,"our goal is to resolve your irs tax problem, reduce your irs tax debt, and relieve your anxiety and stress."
Gossip9aija1,nigeria's $hashtag$ portal for latest news
RecoveryWraps,"handmade, wire-wrapped jewelry for the recovering soul. $number$% of all sales are donated to a fund to assist women in recovery."
DCFC_FanApp,download the free derby county fan app for ios: $url$ & android: $url$ - match day tweets from $mention$
VantyInt,vanty international is a virtual global talent solutions agency with in-country account managers for the it industry
NewsYorkshire,news from around yorkshire
Map_Game,"the map game is a free geography quiz based on google maps. no flash, no need to register, just start finding places on a blind map!"
CynicalBrit,"an acutely cynical games critic and gaming veteran, providing professional-quality gaming coverage since $number$. follow $mention$ to be in the man's mind."
EastMidlandNews,"latest news and sport from across derbyshire, leicestershire, lincolnshire, northamptonshire and nottinghamshire"
CIXgtbt,continuous price updates for compx intl (ci$smiley$
TreatsTrinkets,i write the blog treats & trinkets. i'm a nerdy baker who loves all things sweet and sci fi
_wonderfrankie,"a little giant, with the power cosmic and the wisdom of the universe."
Troptraditions,"america's source for coconut oil! also grass-fed meat, soy-free eggs, organic skin care. follow us for free giveaways, free coupons and daily healthy recipes."
OSUCrush,"send us your crushes & they will be posted on this twitter, anonymously: $url$ favorite a crush, maybe you'll connect!"
GLUUgtbt,continuous price updates for glu mobile (gluu)
sportssupplier1,"sports suppliers usa is your online source for suppliers of sports equipment, sports goods, sports wear and more"
uifellows,university innovation fellows are student change agents in higher education. a program of the $mention$.
ClaretandH,a trusted news source for whufc fans.visit $url$. fb group at $url$u
Startup124,model for talented and motivated $hashtag$. $mention$: $url$ $mention$:$url$ $mention$: $url$
deacon_smith,i get on twitter while the voices in my head are playing poker. favstar - $url$ - $url$
StrategIQCom,imagine what your data can help you decide
psigensoftware,"psigen is the leading provider of advanced capture, scanning and document automation solutions. perfecting simple imaging."
FCFgtbt,continuous price updates for first commonwealth financial (fcf)
BognorRegisHour,"creating a buzz around bognor regis & sussex businesses. tweet and say hi on mondays $number$0pm-8.30pm. hosted by victoria, local marketeer $hashtag$"
Symbiosyssol,we design modern mobile and web solutions that really suit you!
Xplore_In,a good business unit who promises to deliver nothing but the best. any order placed with us will be handled professionally.
Ed4Ed4All,tweeting for a change and educating others about youth risk behaviors especially choking game.we want to keep you & your kids safe! $hashtag$ $hashtag$
StrategIQCom,imagine what your data can help you decide
CPSTgtbt,continuous price updates for capstone turbine (cpst)
RSQXE,must be $number$+ to view this website. follow and mention for retweets. check out the hottest girls at _ $url$
bgmplus,"all the stuff i didn't write about... i'm a gamer, writer and reporter my nickname reider."
SkyBetChamp,official $hashtag$ twitter feed from the football league featuring news and more. follow our main account: $mention$.
belgianbeerday,"belgian beer day worldwide unites the world of beer, brew & bar-peeps around the globe .the charity event has it's heartbeat in antwerp flanders belgium, cheers"
DVRgtbt,continuous updates for cal dive intl (dvr)
lotsahockeyleft,hockey blogger and critic.
Counterintuity,"new marketing for now! web design, online marketing, social media, seo/sem + pr firm in burbank, ca."
crimzonegaming,handpicked $number$/7 news bits & bytes about all crimes gaming xbox ps4 wii pc gaming is a crime (richard ni$smiley$n)
DWgtbt,continuous price updates for drew industries (dw)
billrunroad,get the best painting contractor for your home improvement for your projects.
NewRepublic,the new republic is a mission-driven media organization. we promote novel solutions for today's most critical issues. $url$8
Map_Game,"the map game is a free geography quiz based on google maps. no flash, no need to register, just start finding places on a blind map!"
kommud,akun resmi $mention$ memberikan berita dari berbagai negara dengan sumber terpercaya. buzzer and feed tweet.
bizluxuryhomes,home of the day is a unique way to showcase some of the most luxurious properties for sale in the us. (sponsor contributed content) homeoftheday$mention$.com
SBOBETweets,"your one-stop shop offering a complete suite of sports betting, casino, horse racing and games. sbobet does not limit winners! $url$"
feedingjoy,"happiness is the result of living a joyful life. when you are looking for inspiration and happiness, look for the dove."
westhamfootball,west ham news from a season ticket holder in stb lower also a $hashtag$ blogger on whtid & claret and hugh. mtjap podcaster
am640,"canada's $hashtag$ station for talk radio is the home of john oakley, bill carroll, mike stafford and jeff mcarthur."
StrategIQCom,imagine what your data can help you decide
CBNJgtbt,continuous price updates for cape bancorp (cbnj)
NHLFlames,"the official twitter account of the calgary flames. follow us for all the latest news, exclusive videos, photos, giveaways & more!"
Lex_Kids,the children's ministry of lexington baptist church. we exist to partner with families on their journey to become fully devoted followers of christ.
CopyrightGroup,"music, audiobooks, films, concerts, e-books, internet radio - classic media content for the modern mind."
aSEATaxiCab,"a cab that loves seattle, knows lots of great sports. tweets about seattle. part of a cab group (building in progress)."
About_Art_,"about art - magazin for and about art collectors, artists, galleries, museums, art fairs. we follow back all our friends"
TimothytHaines,"i love everything about $hashtag$, and i'm working to create conversations about $hashtag$ that result in positive change."
