IndPac_news,"latest news from the amazing indiana pacers. fanaccount, not official! follow us and enjoy our posts."
FFNWgtbt,continuous price updates for first financial northwest (ffnw)
FCNgtbt,continuous price updates for fti consulting (fcn)
Suave_TV,no $number$ international online tv | news | musics | videos | events | celebrity focus | interviews | life style | fashion
NowOnWHUS,what's playing now on $mention$.
01756gnlb,weather for $number$
vofnslovakia,"history & current affairs on slovakia. include $hashtag$ in your tweets. member: the vofn network. for sponsored tweets, mail: vofnmail$mention$.com."
GHoundBusHelp,need to make a stop for a customer-related question? youve come to the right place. were here to help! open daily from $number$ a.m. to $number$ p.m. cst.
PKMNTownsBot,bot that automatically posts random map and signpost location descriptions from pokemon. [wip]
Foothill_Dance,"foothill high school dance program: varsity, jv, dance i, and dance ii"
MillwallFC,"millwall football club's official twitter account bringing you news, match updates and more. digital partner: $url$"
Unity3Dscripts,everything you need to know to grow your $hashtag$ on one site.we review best $hashtag$ hacks and trends and curate for you.
SparVolltreffer,ebay-auktionen | ebay-shopping | ebay-suche | gutscheine | schn_ppchen | service-angebote | starke marken | geschenke | informationen
GBLgtbt,continuous price updates for gamco investors (gbl)
MagAwards,the national magazine awards foundation of canada. like us on facebook: $url$1 - follow our blog $url$
KitchenDechefs,dechefs kitchen catering school \catering service
tmj_vt_retail,follow this account for geo-targeted retail job tweets in vermont non-metro from tweetmyjobs. need help? tweet us at $mention$!
Sierra_Magazine,"environmental news, lifestyle tips, and free-ranging opinion from the editors of sierra magazine. follow us: $url$"
MyAlliesTrading,myallies delivers breaking news from across the globe and information on the latest breaking business and financial events. $url$
nobismedia,building your ministry online. we provide modern websites for $hashtag$ of all shapes and sizes. follow us to stay relevant with online evangelization!
wccls,"washington county cooperative library services (wccls) supports $number$ public libraries in $number$ communities in beautiful washington county, oregon."
acrossUpdate,"check out update from politics, technology, health, education, employment, markets, sports, science, adventure & more trending news across the world here"
ymcanyc,"we're here for good, and on twitter we're here to talk!"
TodayILearnd,a twitter feed of posts from /r/todayilearned from reddit.
YieldHome,"yield caregiver home care will provide trained, e$smiley$erienced caregivers tailored to your specifications."
NzMorningReport,"guyon espiner and susie ferguson with three hours of news, weekday mornings from $number$0 on radio new zealand national. join new zealand's biggest radio audience."
facepaulmrevere,"look, i wouldn't follow me either facepaulmrevere$mention$.com"
fdalawblog,"food and drug attorney $mention$, phelps"
The_CP_Swagger,the official page of the cerebral palsy awareness project where hunter gandee carried his brother braden from bedford junior high to u of m's wrestling room.
loveofmaroon5,everything about maroon $number$
tmj_VA_transp,follow this account for geo-targeted transportation job tweets in virginia non-metro from tweetmyjobs. need help? tweet us at $mention$!
acrossUpdate,"check out update from politics, technology, health, education, employment, markets, sports, science, adventure & more trending news across the world here"
EVCgtbt,continuous price updates for entravision comm. (evc)
Man2Bar,we specialise in tours and holidays in catalonia and can advise knowledgeably on cannabis tourism. $number$ $number$ - $url$
SEO_SERP_SEM,"internet marketing | $hashtag$ $hashtag$ $hashtag$ $hashtag$ | info, tips, tricks & news $url$"
asoapstar,"award winning manufacture of hand-made all natural soaps in the uk for sensitive skin. vegan friendly, palm free, cruelty free.$hashtag$"
electricgherkin,"latest up-to-the-minute news relating to tech, gadgets, kindle, apps, gaming, social media, design, publishing, the arts, entertainment and current web memes."
CYTXgtbt,continuous price updates for cytori therapeutics (cyt$smiley$
TheatreVCU,"theatre vcu is the theatre department of $hashtag$ we offer a ba in theatre; bfa's in performance, design/technology/stage management & mfa."
Gameority,"$url$ is a site that publishes updated news straight from the source. site owners, submit you gaming site!"
979ESPN,your favorite espn radio personalities
electricgherkin,"latest up-to-the-minute news relating to tech, gadgets, kindle, apps, gaming, social media, design, publishing, the arts, entertainment and current web memes."
Azzric,"pc & console gaming (retro & modern), comics, star wars, batman, star trek, wwe, action figures, anime, manga, and general geekery here."
JustEatUK,takeaway tonight? get in. $hashtag$ hanging out here $number$am-11pm weekdays & $number$pm-11pm weekends. see you around.
hvidmag,hvid [danish:vi - english: 'white] the hip hop magazine about the white rap & hip-hop culture. $hashtag$ $hashtag$ $hashtag$ $hashtag$ $hashtag$ $hashtag$
uclubhm,$mention$ is proud to present black history month $number$. keep up to date with events and articles! $mention$
GameUpdateHaven,gaming news and updates all from one source
RunningHeroesUK,"we encourage, enhance and reward our runners so they become running heroes. connect your running app and earn points with your runs to redeem great offers."
BKYFgtbt,continuous price updates for bank of kentucky (bkyf)
HRGgtbt,continuous price updates for harbinger group (hrg)
DevilsTerrace,"manchester united supporters club - the devils terrace, bt sport , talksport, rnr football & lbc radio - st holders - stretford ender"
DoD_EHR,your source for news on dod's new electronic health record. $hashtag$ (following & listing does not constitute endorsement.) $url$
waynecountytn,we do our best to enhance and promote businesses and industry in the wayne county area.
_SoundAround_,sound around is a leading source for news all around from top news sites
DAKTgtbt,continuous price updates for daktronics (dakt)
02127gnlb,weather for $number$
WereNIEA,"the national indian education association is the leading education advocate for american indian, alaska native, and native hawaiian students."
MizzouWIM,working to support and empower women in media. located at $mention$.
WKYCSports,"sports stories and breaking sports news for browns, cavs, indians and local college and high school sports teams in northeast ohio."
Man2Bar,we specialise in tours and holidays in catalonia and can advise knowledgeably on cannabis tourism. $number$ $number$ - $url$
FFINgtbt,continuous price updates for first financial bankshares (ffin)
openn_world,newsdesk:world official public european netherlands tv official approved
tickingoxon,"the incredible, online destination for daily offers from o$smiley$n businesses. currently in beta - full launch oct $number$. follow to live for today'"
Gaming_Area,"don't miss any update regarding games and technology! news in english, japanese, portuguese, french, german, dutch and spanish. | contact: $mention$"
HTGCgtbt,continuous price updates for hercules technlgy growth (htgc)
fellowshiphair,"founded in $number$ as the fellowship of hair artists of great britain. members can e$smiley$erience educational events, workshops & master classes with industry e$smiley$erts"
AKB48Fans2,"follow me,disini saya akan membagi/share tentang,picture,profile member2 $number$fams. arigatou $smiley$ admin : $hashtag$ (captain) $hashtag$ $hashtag$ $hashtag$"
openn_world,newsdesk:world official public european netherlands tv official approved
spikesmag,"we love | $number$ | $number$ | $number$ | $number$ | $number$ | $number$ | $number$ | $number$ | bringing the world of track and field to life, powered by $mention$. also available in chinese $url$"
DGIIgtbt,continuous price updates for digi intl (dgii)
01703gnlb,weather for $number$
Cellusious,pixel artist / concept artist / colour wizard / world designer *warm man who likes cat*
SJ_Press,"official sjhs press twitter, where you can submit your pictures to be in the newspaper!"
lifeisawildidea,my mind is a mess.
UFS_SRC,student life & leadership $mention$ where students remain central. bloemfontein campus. rts endorsements
CFNBgtbt,continuous price updates for california first national (cfnb)
ThoroughProcess,simply put.....the life death burial and ressurection of christ because of god is the only reason i live.......
CECOgtbt,continuous price updates for career education (ceco)
NewstalkZB,newstalk zb is new zealand's premier news and information radio station.
xGamingShot,gamingshot is created for living with $hashtag$ and $hashtag$.
CueroPesado1,"blog for downloading heavy metal, trash metal, hardcore, postmetal y others metal rock categories"
SAatSU,syracuse university / suny esf undergraduate student government | questions? e-mail us at: studentassociation$mention$. edu | instagram: sustudentassociation
Unitedinprayer1,$hashtag$ $hashtag$ $hashtag$ $hashtag$ $hashtag$
PLTWMidwest,midwest region engagement team for pltw
lozanoquirino3,extremely amazing auctions
ParadeMagazine,"inspiring stories, celebrity interviews, recipes, and more!"
ABootlegger,"bar inside of sierra sid's casino ta truck stop with gaming, pool tables, large tv's and great guest service!"
AaronsArcade,"the official twitter for aaron's arcade, best free online games on the web!"
paeyc,"a local affiliate of naeyc, a professional organization for early childhood education (ece) professionals, which includes our state parent caeyc."
AperInvestments,trading and investments group
Stmotivationmag,"$hashtag$ $hashtag$ magazine. featuring exclusive interviews with platinum selling artists & covering the latest in $hashtag$, urban culture & $hashtag$ since $number$."
wickedshrapnel,e-husband of $mention$ $url$ $url$ scuf coupon wicked $number$k subs yay!
135Picks,"$url$ home of the $number$,3,5 unit winning picks"
FTVLive,news and gossip from inside tv newsrooms and networks around the country and the world $url$ apple evangelist
FishNribs,soul food restaurant
estereograms,"i made stereograms digital! for the kindle - download to your pc or your kindle, e-stereograms are proven to help your eyesight."
thepiperhull,the piper. newland avenues nighttime icon. monday - get lucky student night. friday - loaded indie night. saturday - music for the masses
UCLUDebatingSoc,"uclu debating society, ucls oldest and arguably most prestigious society. debates every monday, workshops every thursday. email uclu-debate.society$mention$.ac.uk"
CMNgtbt,continuous price updates for cantel medical corp (cmn)
AperInvestments,trading and investments group
TandumEnt,tandum ent is a creative force dedicated to bringing dramatic excellence to canadian theatre and abroad. check out what we're doing at $url$
ValeMartinho,"tourism and events at vale martinho, santa comba do, portugal $url$ $url$ $url$0"
Madrid_IndoKBBR,official twitter of pea real madrid de kab.br | the official real madrid supporters club indonesia
scarc_vk5arc,"south coast radio club inc (south australia) vk5arc. rptrs, bbs, irlp nodes. exams, facilitators & license help."
swarmchan,"i admin the fight white genocide board on $url$ // follow my propaganda coach $mention$, author of the $hashtag$ mantra"
GKNTgtbt,continuous price updates for geeknet (gknt)
FoxSportsRadio,"breaking news, entertainment & interviews"
AperInvestments,trading and investments group
Crewe_Hall,"the magnificent crewe hall is part of qhotels $number$ stunning hotels. set in the heart of the cheshire. it is unforgettable for business, leisure & weddings."
AcePrintwear,"ace printwear has been established for $number$ years, specialising in screen printing, embroidery and bespoke prints. $number$ $number$. aceprintwearuk$mention$.com"
UrbanOpticsSLO1,the most unique selection of eyewear on the central coast of ca. eye exams and contact lens fittings done by dr. david schultz.
MyAlliesTrading,myallies delivers breaking news from across the globe and information on the latest breaking business and financial events. $url$
UWTSDSwansLib,the official tweets of the library & learning resources service at uwtsd swansea!
DearmanTeam,spreading dearman love. dedicated to the insanely talented $mention$. wicked. water babies. evita. appearing in bbc prom $number$ on september $number$
IllBlogRadio,$url$ powered by $mention$ follow us on vine and instagram: $mention$ like us on facebook: $url$ $hashtag$ $hashtag$
BeachFront718,beach front property the best brand! we make sense beachfrontproperty718$mention$.com
TodaysPigskin,"your no. $number$ source for nfl news, analysis and columns. if you love football, todays pigskin has something for you. part of the $mention$ network."
matheme_creativ,"a creative one-stop shop, offering across-the-board graphic & web design, writing and editing services."
CornwallNissan,"new & certified pre-owned vehicles, always an excellent selection in stock, after sale service is what we built our reputation on, serving you since $number$!"
ADRetail,a leading provider of branded credit card programs for many of north america's best-known brands.
MLBPittsburgh,keep in tune with all of the major league baseball teams and all of their minor league affiliates!
FMBIgtbt,continuous price updates for first midwest bancorp (fmbi)
clarinety10,"i want to leave a legacy, how will they remember me?"
newyorkcelebs,new york celebrity photos and videos
ItCouldBe_you,"the world is divided into disabled and not-yet-disabled people. disability doesn't discriminate, anyone could be next."
PsychospamYT,youtuber with $number$+ amazing subs $url$
TyphoonWatch,latest typhoon news and updates from the philippines.
NEWSorNOTHING,"the weird, oddly, unbelievable, crazy or insane news gathered here."
ArapSports,it's a great day to be a warrior!
McDonalds,welcome to the mcdonalds usa twitter page! our awesome team: $url$ - customer service: $mention$ - global questions: $mention$
DPZgtbt,continuous price updates for dominos pizza (dpz)
PennEstatesPOA,"penn estates property owners association (pepoa) is a gated residential community association located in stroud and pocono townships, monroe county, pa"
WhatDigital,what digital is the data source for the what digital ios app. check out our apps at $url$
toyremedy,toy obsessed.
dlnorwaynews,link news about norway
DMgtbt,continuous price updates for dolan co (dm)
JapanTechFeeds,follow $mention$ $mention$ $mention$ $mention$ $mention$ $mention$
Droppinthebeat,"online radio, promoters and upcoming record label! focused on electronic dance music! - live streaming now!"
BestCourseHub,"collect best knowledge about startup, marketing, leadership, personal development, make money online, mobile and web technology."
superTV247,"everything about tv here including news, exclusives & ratings as well as my own opinion! $hashtag$ $hashtag$ $hashtag$ $hashtag$"
02093gnlb,weather for $number$
VOABuzz,"promoting voa's people, programs, & events. check us out online, or come visit & take our studio tour."
RAAFvictoryroll,"pacific victory roll website - $hashtag$ & $hashtag$ pacific air to air victory claims, pilots and aircraft, in $hashtag$. the pacific air war news & images. $hashtag$ $hashtag$"
handmade,a rare glimpse into the life of a top new york city storage auction buyer.
HGRgtbt,continuous price updates for hanger orthopedic group (hgr)
voxnovo,avid giant fan.
LodayaFutsal,"olahraga & aktivitas | jl.trs angronomi no $number$ (haji gofur) tani mulya bandung barat, indonesia."
yskElPaso,"follow ysk el paso for the latest news in the $hashtag$, $hashtag$ area. $url$"
DoxieMoron,i love pokemon and sloths. private/vent account : $mention$
HarmonyBats,impacting lives through baseball - founder aaron nielsen
AnonymousKenya1,conscience of $hashtag$. $hashtag$ $hashtag$ $hashtag$ $hashtag$ $hashtag$ $hashtag$ $hashtag$ $hashtag$ rt$smiley$ are not endorsements.
illusionOFitALL,"magic, madness, heaven, sin"
WeRWorld,"global $hashtag$ account for the world. to volunteer, dm this account. different country each week. this week is ..iris shackleton from new zealand"
KumonSudbury,after school educational based programme catering specifically to maths & english. your child's success is our reward.
HLgtbt,continuous price updates for hecla mining (hl)
smumn,"official twitter account of saint mary's university of minnesota's undergraduate college in winona, minnesota."
edmontonbicycle,"non-profit supporting active transportation (walk/bike/transit) in $hashtag$. we also operate bikeworks, two volunteer-run community bike repair shops. $hashtag$"
HandsonHealth,"lara cawthra, chiropractor at hands on health, camberley, an award winning chiropractic clinic. helping you get back to enjoying the life you want. $number$"
CoastlneConsult,coastline consultants is locally owned. we offer community based research services & professional development workshops info$mention$.ca
bengalurufc,official twitter account of bengaluru fc
ReclaimFeminine,reclaiming the divine feminine
DEEJAYMOB,god $number$st...pro. dj. drgs daler ..c.e.o. $hashtag$. $hashtag$ on $mention$ $hashtag$ music director of $mention$ $hashtag$
Entertain_Upday,all about entertainment
QuantaMagazine,quanta magazine is an editorially independent site published by the simons foundation. follow us for news on mathematics and the physical and life sciences.
Liberationtech,"$mention$'s high-volume news feed on tech, democracy, freedom, human rights & development. mailing list at $url$. tweet endorsement."
CarWashBelmont,"we have been in belmonts waverly square since $number$. servicing the belmont,ma area with our exceptional detailing services and our impeccable customer service."
ArizonaDOT,"driven to get arizonans where they want to go. news & info from the arizona dot, hosted by pios tom, caroline, doug & garin. tweeting & driving don't mix!"
1041theBlaze,"pure rock alternative, $number$-1 the blaze"
NutsNutscom,nuts nuts is the first $number$% natural nuts store in aruba... and we are very proud of it! healthy done alfresco!
BrownAthletics,official twitter account of brown university athletics. $hashtag$! $url$
ETAhand2mind,educating students is the most important job in the world. we share your passion for student learning. together we champion learning by doing.
CYMIgtbt,continuous price updates for cymer (cymi)
arkisoundnature,official arkisound - another nature of sound...
DiversityIsALie,turn off the sports! get out in the streets white man!
Punkbusinesstv,cash from chaos.
SJtBClontarfRC,"welcome to our roman catholic parish. please join us via our webcam, mass times are sat. (vigil) $number$0, sun. $number$0, $number$5 & $number$0, mon. to sat. $number$0 ist."
WSDreaming_Cubs,"big fan of the chicago cubs, blogger, season ticket holder. check us out at $url$"
LorneEC3,"mgoblog board moderator, michigan alum and bleeding maize and blue. co-host of wolverine wanderings on wolverine sports radio."
MidnightGolf,"empowering young people to maximize their potential through the game of golf, life skills, positive peer influence and mentoring from dedicated professionals"
leerwiki,de slimste community van nederland
musicopenn,newsdesk:tv2 - music official public european netherlands positive music tv official approved $url$
Somers_Library,somers library ~ providing excellence in library service.
STREETMONEYPROM,"street money entertainment/promotion is a promotion for (artist,events,news,sports,etc).. in houston tx. follow us! streetmoneypromotions$mention$.com"
SkywarnCarolina,follow if you want to keep updated on everything severe weather! ask questions about your area. join skywarn and get involved...this is a very high traffic page
AC_library,the library is committed to promoting academic & professional success through reliable and current resources $mention$
AtheistQ,"daily atheist quotes, images, and videos. get quotes, debates, and more with atheism for ios -$url$"
_LifeInSong_,"music is what life sounds like. it e$smiley$resses that which cannot be spoken. music is not just what i do, it's who i am!"
krrbsale,"krrb (pronounced 'curb') is a scavenger hunt at your fingertips where you can thrift, rummage and discover local treasuresat your doorstep or around the world."
DeftEar,"creative sound communication solutions - sound branding, composition & sound design to enhance interactive & immersive creative media, vr & retail spaces."
rationalwalk,intelligent investing is not a random walk. tweets are not investment advice. rtendorsement. disclosures: $url$
monetpearson,i am the moon. goodevening.
georgiosofp,"home of the fresh-n-ready!! $number$ locations serving fresh pizza, wings and more in ohio and florida."
michaelearl318,$hashtag$ $hashtag$ $hashtag$ $hashtag$ $hashtag$ $hashtag$ $hashtag$ contact me mixtapeslot$mention$.com $number$-731-7760 call me
TastriesBakery,"tastries provides a range of handmade baked goods, including cakes, our famous designer cookies, cupcakes, gourmet cookies, brownies, cake pops and muffins."
GAINGrantham,grantham autistic information network (gain) supports families with autistic children in grantham and the surrounding area.
corporate_divas,inspiring divas to be the force! seeding positive news about women and our world!
107_1ThePoint,justin in the morning and today's modern mix for ny's northern capital region & tri-county area! wkbe-fm $number$ corinth
qweboobusiness,qweboo business - the best $hashtag$ posts at one place. helping you drive traffic to your blog. signup now : $url$
TweetMOTIVATE_,"bringing you daily doses of motivation, wisdom and just a general kick in the pants!"
HamestonBooks,"we specialise in secondhand, rare and out of print books. visit us $mention$ macclesfield or online below. books bought and sold."
ILove500px,for the $hashtag$ lovers. none of the photos are of my property.
santamarialupo3,highly superb auctions
RAH_LSimons,we provide non-medical in-home care assistance for seniors who want to live independently in their home.
ieeecsd,"ieee center for secure design. platform-independent software security e$smiley$ertise from industry, academia, and government."
Chickenify,"determined to become one of the few, the proud, the marines. i'd rather die for something than live for nothing. i strive to help those who need it the most."
LSU_FISH,"prof/curator of fishes, $hashtag$ $hashtag$ ($url$) & $hashtag$ ($url$) $hashtag$ tedx $url$c9"
RightatHomeNWOC,we provide in home care and improve the quality of life for those we serve in nw orange county and se la county
RAHGlendale,providing trained and bonded caregivers to assist elderly and disabled adults in their homes.
BusinessDay,"the complete view of business, published on fairfax media websites, including $mention$, $mention$, $mention$, $mention$, $mention$"
RightAtHomeWLA,right at home west provides in-home caregiver services for seniors and disabled adults with home care needs in the los angeles area.
Medworking,physician and healthcare jobs nationwide.
RightAtHomeOC,our home care services are built around your specific needs.
rahinlandvalley,this office is locally owned by terry and lisa jeffers. they are passionate advocates for southern california seniors.
RightAtHomeVC,"we provide in-home, personal and companion care to seniors and disabled adults to help them live independantly with dignity. $url$"
TMDNoMore,information on temporomandibular joint dysfunction as well as new treating methods
Mangal2,actual restaurant. for bookings email: info$mention$.com or call $number$ $number$ $number$ $url$
LoveImanCentre,"love iman centre is an institution of child development in malaysia, offering a nursery and pre-school service."
SactoDivorce,miller and associates are sacramento family law attorneys who handle an array of family law matters.
Wellblocks,"founded by dr caroline keddie. a modular system of massage blocks with personalised programs designed to heal, prevent injury or just make you feel great."
ReviewOrDie,"art cannot be objectively measured, and i'm not gonna try. what you read here is my opinion, and i stand by it. welcome to review or die."
NCHDPH,the north central health district is the public health district for $number$ counties in central georgia.
begleylawgroup,new jersey and pennsylvania elder law and estate planning law firm.
zenoss,"zenoss is a leading provider of unified monitoring and analytics software for physical, virtual, and cloud-based it infrastructures."
Health_in_hand,a healthy outside starts from the inside.
KMESystems,"kme systems, inc. provides technology consulting services that deliver the perfect it solution for your business."
MusicBizEmpire,"we feature the latest music, industry news, tips from the pros, how-to guides, and more. $hashtag$"
FGOpera,"fgo, celebrating its $number$th season, stands as one of the most established performing arts organizations in florida. $hashtag$"
IvyWise,your source for the latest information & tips on college admissions and $hashtag$! from dr. kat cohen & the ivywise team of e$smiley$ert counselors.
MadeFromRI,we feature the best of rhode island for friends near and far.
Crimson_Chaos,"the official twitter account for the ua athletics student group. follow us for inside information on games, opponents, and road trips. $hashtag$"
MeijerGardens,inspiring. beautiful. new. $hashtag$
AFHSCPAGE,armed forces health surveillance center
anotao_news,top news published $url$ $url$2 $url$ $url$
SP1RACY,"i tweet about tech related stuff mainly, pc's / macs / mobile phones / gaming / and the odd tweet about movies."
RLF,"ingenuity has a color. rlf is a public relations and marketing agency devoted to ideas, strategy and service."
