_keepingupwANT,$hashtag$ | $hashtag$ | future social worker | god won't put no more on you than you can bear _
atamlicious,"i'm not saying i'm gonna change the world, but i guarantee that i will spark the brain that will change the world~tupac|create rose gardens|m.ed.| ed policy"
MaryEmilyOHara,lgbt reporter for $mention$. trainer of blind dogs. one time i won $100 in a twerking contest. mohara$mention$.com
_sheteelove,$number$ | capricorn | future ma | sc: tee_latoya | ig: tee_latoyaa | $hashtag$
carolyn_demore,r.i.p daddy instagram: $mention$
krissstyn1,hi. ttu17
SDK_Selena,sdk or die
DebbieAustinPR,head of b2b events at archant. personal account $mention$
Endless__Skye,just a regular at the reject table engaged $hashtag$ $hashtag$ i love my twin $mention$ $hashtag$ _ xb1: endless skye ig: endless_skye
TynieshaNicole,everyday influences are my inspirationmusic drives my sanityceo of my life and eventually my own companyvsu alumni jersey girl. grad student
miriam_valles,a dream you dream alone is only a dream. a dream you dream together is a reality._ (john lennon) let love rule_ (lenny kravitz)
94hesinspired,do whatever makes you happy
KTMcG2,i write a beauty blog also love me some metal music !!!
iMGlam_,just call me glam..........
I_Will_Rejoice,"i am a mom, a sister a daughter, a wife and a real friend to anyone who needs one. : )"
94hesinspired,do whatever makes you happy
MorganMylesLIVE,"a country/soul singer-songwriter in nashville. click the link in my profile to see my new lyric video of $hashtag$ fb, ig & sc morganmyleslive"
TaraNikitaBlake,interdimensional traveller. interpreter of energy. intuitive consultant & tarot reader. lifelong student of astrology. sovereign creator.
BINGEBENEDICT,he's just kinda beautiful
sthuru92,painter - songwriter - professional dreamer - born to trip * check out my soundcloud and i will love u forever * $url$
suxpistol,somewhere in buttfucking florida
94hesinspired,do whatever makes you happy
its_annnaaaa,ak $number$||
94hesinspired,do whatever makes you happy
kimberlyxmay,"$mention$ _ be a girl with a mind, a bitch with an attitude, and a lady with class"
TaylorNiles4,basic
BestDateEver,"relationships, couples, dating can be great and can be hard for you. we offer tips & advise."
94hesinspired,do whatever makes you happy
MaiaMamacita,$hashtag$ $hashtag$ $hashtag$ $hashtag$ $hashtag$ $hashtag$ fresher than a pillow with a mint on it.
luvjesuscrisp,jessica
ligiahouben,"ligia houben is an author,personal growth coach, public speaker, and grief & loss e$smiley$ert. she is the founder of the center for transforming lives, in miami, fl."
_forestmermaid,the creative life of a landlocked mermaid.
kepripep,dinos before bros.
sarahviegas_,i'm searching for something that i can't reach.
elean0rr,still wrapped around your god damn finger
NormaSmith93,"dont cry over the past, its gone. dont stress about the future, it hasnt arrived. live in the present and make it beautiful."
94hesinspired,do whatever makes you happy
jamiemarie_84,"im a simple girl with a huge passion for yarn!! ive opened my online store, please check it out. i am also fighting endometriosis. and spreading awareness!!!"
Duplex_R,eat clean & praise god.
annaballerina15,anna. student. cat and dog obsessed.
jbbelievejustin,ariana smiled at me bye
aprositicat,"____,___,__, _,, __. lola for some people...my soul always was a nomad. greek."
sheyitaylor,"daughter of my parent ,i try to live freely wit pipu arnd ,don't take life hard on my self ,,frnd $number$ my frnds ,servant to my lord n saviour !"
aniekanekah,cyber entrepreneur. online influencer. blogger. jci nigeria ambassador. dedicated in training. fearless in competition. humble in victory.
rocoh94,love my boys_$mention$ + is_n _
FlamingAriel,we live and breathe words.
FrankeeCastro,just a puerto rican thats thicker than a bowl of oatmeal. c/o $number$ babbbyyyy
asunsetinmyvein,i solemnly swear that i am up to no good.
taisyamontes,sup
Francheskaxx_,rip jesus m.
jillmariecarr,"mother of three, marathon runner, writer for runhaven, the-newshub & modernmom, owner of carrs backyard oasis and stables, animal advocate, personal comedian"
mikalaamy,just a ginger living the dream
Roberta_Grimes,"author, afterlife e$smiley$ert, business attorney, wife, mother, grandmother. author of the letters from love series and the fun of dying."
_IreneMalik,"i am greek directioner, zquad and mixer *:* i hope one member of one direction or little mix or zayn malik follow me"
jadeemtaylor,there are so many beautiful reasons to be happy _
Yogirlkaily,"whatever you do, work at it with all your heart, as working for the lord, not for human masters. tamu'18 | ig: $mention$"
Mcallan213,band obsessed & cat lady stressed
ParanoidLovatic,"i made a daisy chain from phrase, verse & punctuation send me a postcard from paradise bazooka esquimau icon for hire follow : $number$/14-10/14 $number$/01/15"
astoldbymad,_ and i want life in every word to the extent that its absurd. msu $number$
UttDianna,blogger _ gritty and curious _ incurable troublemaker _ news addict
MacieGraham,"eventually, all things fall into place. until then, laugh at the confusion, live for the moments, and know everything happens for a reason."
GemmaBrown_8,my daughter ellie is my whole world _
twerk4mariah,|19.| snapchat;; rstickk| starbucks barista | rest in paradise grandma alice my sweetest angel |
ACrimsonLily,waiting to take that hand and run.
Brett_Elizabeth,glitter on the mattress. war paint. lace on lace. *nothing makes one so vain as being told one is a sinner.* designer of $mention$.
kaeli_tuinstra,"i'm not superstitious, but i am a little stitious...cal u class of '18"
kudinurse,"mom, nurse, beach boys fanatic, my morning jacket junkie"
TonyaAtki,"mother, friend, redskin fan all around awesome individual"
ChanIsom,"come on make it easy, say i never mattered"
Genn_Coco,"i mean, my mom thinks im cool"
trine_bn,hi $smiley$
duckyy1630,"csusb | life is meant to be an adventure , so get out there and e$smiley$lore it | slowly finding myself"
rbeew,excuse me while i kiss the sky... _
Kaaatellyyn,steven fernandez esparza
jadeefuru,third eye on fleek
CharlotteCoster,reading uni graduate|ch old blue|traveller|theatre addict|book nerd|tea drinker|writer & blogger|$hashtag$|like what i say? you can read more...
sthrnsassafrass,sweet. sassy. god. family. coffee addict. all things girly with a hint of tomboy. aba therapist. soon to be arizonian. forever crushing on my handsome man.
traplordrebecca,future nasa star/astronaut|bhs'16
NagyovaPetra,"girl who loves all good things $smiley$ i am happy to share mine and see yours. greysanatomy, scandal and gameofthrones are only things i watch"
AbbeyPeterson45,instagram:_abbeypeterson
showmethebutt,my only enemy is me. abracadabra
Amyocean_,$hashtag$ $hashtag$
ameliacourtneyy,stay cold.....
hayley_spechtt,there is no such thing as an ending. just a new beginning _
IBJSCA,$mention$
deenichh,ig: dianaa_nicholee / vine: dianaanicholee
TrudieStride,just being me
vebrown,"psychology, ux, cider & bristol"
CassieisAllred,my words are like ponyboy curtis.. they stay golden.
KatieKurnick,are you a mermaid in a school of fish
hjschnyderite,heather. $number$. vet assistant. mcc.
KayleiighLouu17,((kayleigh.23)) miss independent. a dream is a wish your heart makes
izzierobinson96,english lit/german undergrad at royal holloway. i make myself laugh a lot.
supsides_,nineteen & bitter
KatieBarryHere,created on a dare by the ghost of jayne mansfield and a group of scientists from $number$.
rachamoore_,half assin' it since $number$
vict0ria_af,feminist
amandalynLV__,mind your business hoe
Amarie_hey,"work hard, play hard. doing what i feel like."
addiejames15,university of memphis |
ShearerPain,i'm polite prostate free since $number$
_MissMiller,"out of the mountain of despair, a stone of hope - $hashtag$ $hashtag$ the $number$st $hashtag$ alpha chapter $number$"
sarah_arnold,"day job: academic advisor, night job: comics editor at $url$, afternoon job: naps. sometimes i stream on twitch (sarah08beth)"
fredalicious,editor of freda's voice: a lifestyle blog in canada. pr friendly!
KristenCannonn,uri '18 delta zeta
nattycrossaint,"foolish, idiotic, impractical, petty, pointless and senseless."
Crickles16,on wednesdays we tweet $hashtag$
ICotterman,aye i'm anna and i'm basically a goddess of crappy quick fixes that turn out okay
sarah_parisot,sofia nsm les autres.
_SARAnade,freedom is a state of mind
pey10allen,i dunno what $number$ put here
N_Divinity,living testimony. i'll be your favourite success story.
Misha1515,czech directioner ___
kakitsme,"heb $number$:1 true love is a mixture of friendship, appreciation & happiness. $hashtag$"
Lela_LaPin,"i'm a friendly, smiley, kinky girl. in my spare time i advocate for animals rights, practice photography and bake vegan cookies. $url$2"
joelle_A_,changing the world with good vibes
HOGUEMARISSA,me
nadine0602,la vita va avanti. trinidad.
bethanylouisex_,$number$/12/14
M_fayy,i could potentially be the worst
kitkittikatt,$mention$ | $mention$ | $mention$ | $mention$ | $mention$ | $mention$ | $mention$ | -no more fan signs- | $mention$
julia_ivxx,blondie
SilviaLD78,we are the makers of music and the dreamers of dreams $hashtag$ $hashtag$ $hashtag$ $hashtag$
AbbieFisheer,"$number$, symonds"
brea_alvarez05,$number$ is a great number
SKastrinelis,"$hashtag$ $hashtag$ manager for $mention$, $mention$, $hashtag$, & robotics at $hashtag$ animal lover travel enthusiast proud geek"
MckennahW,$number$4.15 instagram// kenz0514
nthabi_L,just as long as you're happy
halebale_,fidm sf / aries / $number$
cavalcar,"mg, ya writer | gamer | addicted to sweets and caffeine | obsessed with pens | rep'd by $mention$ of $mention$"
kittxen66,i'm going but i need a little time...
LexiCheekz,i just want to see the world
HugginzByAngel,$hashtag$ $hashtag$ $hashtag$ $hashtag$
OBEYIRWINN,we are the kings & the queens of the new broken scene.
monressia,"desperate for you $number$-05-14 hv $number$/4 + ana&band acc,leda, wml $number$/4"
maddielarson123,sacrificed my life to that one radioactive band and nico vega... please support the $hashtag$ $hashtag$ project _06/27/15_07/10/15_09/26/15_
Claudsbelle1,season $number$ the mysteries of laura i live for! $mention$ debramessing dancemoms pfieff madonna mdna $hashtag$ $hashtag$ live laugh love
prettyblonde24,fate
Krminck,$number$-pnw
cherrysparkler,"follow me....nights out, butlins, wwe, tna, lfc, being a bit of a gym wanker ....my girls oh & saving the world.. insta..snapchat.. cherrysparkler $hashtag$"
horan_hugger_,adam used to dm me on my cellphone
ayeeepuhreal,currently situated in bali
Katheeriinee__,"d yr, d t; yr o_ kd o . || eternally blessed $hashtag$ || $hashtag$ $hashtag$"
IggyVotes,i stan iggy and nicki . mariah carey is the greatest vocalist ever. $hashtag$
karlyn_kirchens,hit me up on the trails | $number$-26
LadyGrantham_,being tested only makes you stronger.
cailin747,"artist, refried bean e$smiley$ert, doodler extraordinare"
anna_riley_7,lhs $number$
MadHayls,gerardvioletbrentyleravvy&esmephan bc phan
the_nerdiest,what am i doing with my life...
RyleeMapes,$smiley$
Chadowboxx,"gresham's premier salon for multicultural hair. owner, stylist, mother, diva and hair care e$smiley$ert."
clothes_mindedx,muse xx fashion scholar $hashtag$
AlletaB,i'm outchea living my life and what are you doing with yours? reading this
EmoniKarlyse,r.i.p jordan d. _ | let go and let god
Th3MetalBender,"i am magneto's twin sister, metal master and mutant. i'm the nice one.||18+rp|mv|maturecontent|$hashtag$||"
AbraAlpaca,belieber
Penta_holic,"you are not alone, you are right at home"
ValLeStrange,whatever doesnt kill you simply makes you stranger
_halee_xo,$number$ _ | stay humble | $number$teen | aries .... fscc
ashleyyytg,ig: ashleyy.tg
abbymeyers_,you're not gonna be okay nutrientibus meum asinum msu '19
lourryhes,"h as my king, m as my queen."
bout3fiddy_,could the holy spirit come down to the front office plz
YMinisterswife,jesus believer. church lover.
RebekahSBryan,"god made, jesus saved, texas raised smtx psalm $number$:26"
fighter_grey,martial art world champion. police officer in new york. $number$x police kickboxing champion $number$ years old. $mention$ is my friend and student
NotGjvingUp,'99 | i have a heart that wants to vandalize | bands are my obsession | $number$/34 tidesquad
NathaliaCamposL,"follow your dreams, believe in yourself and don't give up"
AnnieBarrins,$url$
ashleigh1796,$number$babes | gannon university '19
welchtechies,"welchtechies, tweets tech content curation, android stuff, lovely interesting stuff"
Sbeezy28,patriots football is my shit!!!!!! brady-belichick= unstoppable
Kympocalypse,"i'm complicated in my simplicity. or simple in my complexity. no energy for anti, i think only in positives. lovemonger. i hope we all make it."
amy_petrocellii,"senior at chesterton, part time carnie, part time cheerleader $hashtag$"
stfumcvey,basic
capuletrosa,(rp)
__youngB,aspiring social worker '17
bethxlockhart,$number$. ni.
maddie_wagar,who is in control?
CPrest24,you can't win a race if you don't run. -mr. waage
floricelgnzlz,$number$ radiate positive vibes
PearlyDenoble,many wealthy people are little more than janitors of their possessions.
dignitasBru,video games. community manager/editor for $mention$. real life baroness. lover of beer and the oxford comma. opinions are mine! featuring: $mention$
yvettevanity__,houston
LISDTechie,"google certified trainer, google educator $number$ ~ $hashtag$ founder/moderator, geg centx leader, edcamp organizer ~ dedicated to learning new things!"
jacob22121,"$number$ year old female, feminist, animal lover, vegan, fighting for animal rights."
LaurenLawley_x,"_were you born to live or were you born to die? anna is love,anna is life!_annataughtyou_ _everyone makes mistakes_"
999tatiana666,ig: tatiana.ljp
Julia_Runaway,just a girl who doesn't know what the hell she's doing with her life.
Sam_Ryan97,a tiger doesn't lose sleep over the opinions of sheep...and neither should you
micmuh_kel,pittsburg ks... for now
ShorT_Caake_,$hashtag$ $hashtag$ $hashtag$ $hashtag$
elisazied,"food, fitness & fiction blogger, award-winning nutrition e$smiley$ert/author (younger next week etc.), walker/hula hooper, ya book lover/writer, proud wife/mom."
madamsnake,zoie ~ any pronouns ~ $hashtag$ ~ pro-hoe ~ infp/enfp ~ _
beckykarsh,on a mission to change higher ed ii managing director $mention$ west coast ii formerly $mention$ $hashtag$
yaaawnuh,"$number$, feeling good living better"
FosterTheKim,social work student // $mention$ x
morefxjuseyo,"preparing my soul, mind and body for f($smiley$'s slayage. $number$ walls bitches"
angelmval96,happily in love with matt ramirez mommy to a prince $number$. future dental hygienist. trying to figure out life in h-town.
miabarnshaw,best known for enjoying quesadillas and milkshakes
badbadhuman,she needs an hero
saragallon,"el que no arriesga un huevo nunca encuentra un pollo, o_ decir por ah_"
karlalax3,you might be right but i don't care// ajs_
Bibo_chan90,i stan japan's national rapper takahashi minami $mention$ & $mention$ child ........... i'm a disgusting hetero and tsundere queen
glenyari,"puerto rican, blogger, feminist, staff writer $mention$, former $mention$ intern, colaboro $mention$, parte de $mention$, hija de glorian."
vibemeharry,"follow the spiders, why can't it be follow the butterflies?"
olyaantipina,i learned to feel it reaching for the truth
ChefsWifeSteph,"food geek, event planner extraordinaire, all around sassy pants."
alexaNDranoello,"'ur fun, ur just not funny' - my mom; 'ur one of the more ridiculous ppl in my life' - bff"
aeon456,i have aspergers so if you think you are cool & in with the in-crowd just piss off and do it elsewhere please - can't put it more basically than that
Runsome_ERINS,utk ain't none to it but to do it.
hheyitsmonica,not a mom
Whiskeyna_tcup,"love, peace, and a strong drink"
JustJJWriting,"author/ghostwriter, pup mom, wine, racing, embracing life - the difference between fiction and reality? fiction has to make sense. - t clancy $hashtag$ $hashtag$"
geeksandcleats,editor in chief of geeks and cleats llc full-time blogger*professional binge watcher*batman enthusiast
amyhugsx,i'm a young urban psychopath
kumpalicious,| $number$ | long island | everyone's favorite second choice
kaycolbsss,kayla colby. $number$. md. aacc. instagram - colbykay. nursing major.
samanthashep_,"scottish person living in cambridge. $mention$ volunteer with $mention$. people person, often labelled 'opinionated'. christian. psalm $number$. _"
LookAt_JAZ,the good girl
live_LIFE_loyal,read the autobiography. it's way better check out my blog $url$
ashleeeighty,$number$. i complain and talk about my dog a lot.
abigailz23,smithtown east $hashtag$|li lighting flynn national $hashtag$
PopYourConfetti,$number$h and fifth harmony should do a collab $url$
VOLDEBOOBS,"htel cortez avec du pop-corn, une pile de livres, des animes et des sries $mention$ slytherin babe_& mirkwood +1"
mrz_cutiepie6,"trey, aug, and chris are life"
DeeDe_vine,brighter than before
GinaMCooke,i make awesome events happen in museums! $hashtag$
Crislex,personification of a paradox to shawty be the glory... xbox gamertag: plas7icki77en
EmilyNonko,"nyc-based writer, lover of real estate. wsj, observer, curbed, bed stuy blog, more. reach me at emilynonko$mention$.com."
_theIsh_,"and though she be but little, she is fierce."
SierraSoliz,tx y'all | $number$ | kb
meganstrickler,ipfw freshman| indiana | $number$ | $number$7.13 | grease monkey.
mak_dibenedetto,wsu _ im just sayin
a_darnoc,retail&coffee addict | animal lover | go pens _
perfectjt,ayyy lmao
librarian_kate,"librarian diva, knitter, anglophile, seattle lover, liberal, techie, steampunker, foodie, baseball fan, nj e$smiley$at, feminist, whovian, geek. all opinions my own."
BriannaSzollosy,cats cats cats
meredithrides,nau $number$/zone $number$ jumper
passthewhiskeyx,$number$ | animal lover | student mental health nurse | scotland | music enthusiast | make up junkie | pugs | lover of piercings && tattoos.
musa_gwebani,the truest of patriots. mabayeke umhlaba wethu. mthatha is love. i don't feel no ways tired.
MSWImages,san diego-based photographer
Ayee__BASSH,pro black. $hashtag$. rest easy ed. sc: ayeebassh
AdrienneSmith40,serious blogger helping entrepreneurs l engagement superstar l mom to kayla l loves people l serious brownie eater l giving heart
LynseyWard83,carillion admin support and guide leader in training for $number$th birmingham.$smiley$$smiley$
camerakatiegi,i'm not very clever on twitter but i definitely try..senior digital media major at obu ..$mention$ love me- i'd love to work for you..
Emily_Phelan01,"though i fall, i will rise again micah $number$:8"
pontotoc2,curious urban pioneer occupying a century old building--once bordello--once hotel--now home~
beababyy,$number$'3 with an attitude
dodd_haley,soccer___
piprufus1,r.i.p mr pip $number$/5/2001 - $number$/4/2015 run free my sweet boy
joydelacrruz,"time is precious so cut to the chase. ps, those are my chanclasss"
DeraGracia,just ordinary woman.
sonia_smith,"associate editor at texas monthly, hoya, russophile."
VerbalFlair,pardon my bohemian ways...
stormy_strydom,i love music !! really want $number$ have djing and singing lessons !! my dream... love dogs .. $hashtag$ my babygirl
sadedoes,no longer student but always learning. cook. knitter. seamstress (not terry pratchett's meaning). blog: $url$
MarthaKeesy,joshua $number$:9 _ $hashtag$' | $mention$ is my person! _
emilyjanegreenh,$number$-- student nurse
twotatme,darja bajagi
Msmillionj,just doing me!
TinaTargaryen,i am obsessed with empire
theedenreboot,"the eden reboot, cancer thriver, health and wellness guru, seeker, speaker, thinker, health coach. dedicated to helping you! connect - lets talk!"
Antara_Man,"a yoga aspirant, writer, blogger residence earth $hashtag$ the change you wish to see in the world! get $number$ amazing ebooks for free! sign-up at $url$"
Ms_Whitmore,"christian, poverty-fighter, feminist, brownie guider, vegetarian, crafter, tea drinker. thoughts my own."
Juanita_Estrada,"totalitarianism(left)-------(right)anarchy(no govt) right of middle. i'm a reagan,cruz,mike lee,mark levin republican. mark levin fan $url$"
klee_swims,"i don't blame you for being you, but you can't blame me for hating it"
chayaseffy,the artist. never one to be tied down
jaureguiblaah,i left my notebook full of possible twitter bio's on the moon... $number$/6 & jacob whitesides
CarmielleT,instagram: carmiellecymone
ZariaVonMars,nothing to see here.
ericaspinks,"living a creative life - writer, quilter gardener, dreamer. my personal opinions here, not those of my employers."
EastCoastPinkyy,buffalo bound $number$ sc:$smiley$$smiley$bae$smiley$ ig :east_coastpink
luchanik,"used to be a travel agent, but now i'm just a traveler! i love bhangra, bollywood, $hashtag$, $hashtag$ & making $hashtag$. i care about a lot of things."
ElainiMcMahon,"yes, i'm the girl who drives the orange dart"
JessicaTootell,all around awesome chick.
_floressierra,'i'm living on a natural high'
Courthansenn,dont mess with my fucking stromboli// _// wvu18
aly_ables,biologypre-med_ alum
KarinnaBriseno,i have a black belt in awesomeness
OD_optimist,"i work with people in organisations creating energy, raising aspirations to create vibrant cultures. i do od. it's real work. $url$u"
demullvain,"going home for the summer . music and art for life $number$ will always love you :* best friend de, and chey"
TheFieryGinger,"incredibly obnoxious, tattooed, classy broad.. lover of life i'm the most awesome person you will ever meet. amazing chef & blogger"
sarahh_hamilton,scsu $number$' | __
kerryraymond_,my mind's wide open like starry skies i ask god questions and wonder why the hell that you're not here i wanna disappear with you now
greenecohan,now you're one of the most important people in the world to me
ValentinoSlut,i'm that skinny bitch in the club.
danidaedae,grab life by the balls
ShelbyNT,i got a certain lust for life.... i got plans ig: shelby_nt
ELECTRlCLlFFORd,sharp words like knifes
KateGalleran,just a cool mom living life on the edge.
winelover_soph,its $number$% nutrition $number$% fitness. sf || csun
HisProtegee,"i'm natalie, $number$, sherlock holmes' protge. i'm on the side of the angels...at least i try to. |$hashtag$ , bbc sherlock, descriptive, mv, $hashtag$|"
TrialsOfPast,infp. triple (ascending/sun/moon) cancer. ghey(not an acronym) switch/vers. nsfw. $hashtag$.
JoBirchPhaure,"passionate communicator for migrant help, omnichannel enthusiast. do gooder, feminist, opinionated leftie. active socializer, into wine, cheese, dancing & dogs."
CiaraAmore,"a little iyanla vanzant, a little gucci mane, a little oprah with a dash of bob marley and warren buffet"
nopeimamermaid,me looking in the mirror: someone under stress meets someone looking pretty
hannaareeese,wait what |-/
ColorMePrivy,i_miracles & believe god speaks through dreams. i know what he can do cause i've seen him do it. tweets not for media use.
Pardon_mm,ig : $mention$
rakkkata,ig:agnesdiaaz | phhhoto:agnesdiaz | high on oxytocin
lavaIamps,$mention$: and to the ones in da back... i'm blessed to have y'all ridin dis dick
__eunice17,sfa '16 $hashtag$. xa (treasurer). driving jacks. christ follower. $hashtag$. i tweet a lot. thank you to everyone who tolerates me.
betsyisonfire2,neuroscience |feb. $number$| __| g_zalo dance co.
babyveeee_,the pepper to his iron man
emmaaaaat_,| $number$ | uk | edge hill university | someone you dont want to know.
Syd_Nikki54,this life is sweeter than fiction. junior. tennis $mention$ claib. sc$smiley$yd_nikki5454
SerenityYou,"i'm mum to $number$ and i blog over at serenity you, where i share crafts, kids play ideas, recipes, hints and tips and family life"
katexon,deptford
myjaedah,striving to be my best self in a world of corruption. video storyteller. kreative. aspiring activist. lover.
TaySwag,jsu. _. romans $number$:28. veni vidi vici.
cindy_kowaleski,"love: my family/husband, impractical jokers, my cats, drinkin, my life!!!"
turoxshakur,bitch i don't fuck wit you. ig: turo$smiley$hakur
AndreaMurilloTC,"tbh a lot of shit doesn't even matter. be the person your dog thinks you are. small boobs, big dreams. on my grave i want vip not rip"
__liSkay,$hashtag$
Faith_Kadirah,beyonce.
LonaMatti,shhs
MaliH95,derek_ ct $number$ rip lana grace
JennyFu3,uc twerkeley
_alisaus,writing and branding; examining different forms of storytelling
donnalouise02,"$number$, somerset"
LAURthargic,last year i abstained this year i devour without guilt which is also an art
prettygirltete_,"pretty girl, ugly word"
queenfeminist,the ramblings of a politically aware teen $url$
_frecklez,glenn is alive
Lulolicious,"und jedem anfang h_ngt ein zauber inne, der uns besch_tzt und der uns hilft zu leben."
lourryhes,"h as my king, m as my queen."
fantasticalfan,"a hopeless romantic with a passion for music, writing, and photography. oh yeah, and potatoes! adventure is out there"
emmahicklin,if i'm not on twitter i'm in the garden. otherwise im in my campervan. views e$smiley$ressed are my own.
JodyField,"learn the mind-splitting truth about: jobs, life, happiness, work, labor, success, politics, justice, world & national news, health, america, usa and more."
playboymv,tao backwards is oat
AndrenaePhillip,i love jesus! ig: andrenaee | snapchat: andrenae
babybeasle2,i like to dance on my tip toes under bright lights. // mchs _
LoveMyOra,sen16r
kierpanda,social media manager for mobile games and $mention$ | i write a video game food blog | i formula $number$ ( ) | qtling
Queen_VBandz,"$hashtag$ sisters:taiyah, nyla, and $mention$ brothers:lil edd, anthony r.o.d:layshia bffl$smiley$rince and cierra niece$smiley$ky"
SugarFreeCoach,$hashtag$ $hashtag$ writer host voice $mention$ $mention$ $hashtag$ nominee $url$
