rjxok,cool bio
Loirinhadevdd,snap: amo-nutella // s s_ a melhor cena de sempre $hashtag$
heartless_amy,were all in the same game; just different levels. dealing with the same hell; just different devils.
CloseTheDealTV,passionate about improving $hashtag$ $hashtag$ and $hashtag$ for businesses nationwide! $hashtag$ $hashtag$ $hashtag$ are you on linkedin? link below
sheerluke,true friends stab you in the front
Breezylovininwv,$hashtag$ $hashtag$ $hashtag$ $hashtag$ $hashtag$ $hashtag$ $hashtag$ $hashtag$ $hashtag$ $hashtag$ $hashtag$
jmilladatrilla,obxnative|uncg'17
Love_bug1016,token asian. me love you long time. $url$u -filter:replies
Smurfitt_16,$hashtag$
saidtaybae,calu '18 | delta zeta
TaylorMcKinley5,cheers to the here and now esther $number$:14
LizDeepDown,"photographer & manager of $mention$'s street team. you don't question the wiggles, jon. i'm wiggles af. for photo inquiries: lizpetersonphoto$mention$.com"
Janbaby_10,i mostly just retweet pictures of pugsi never met a honey whiskey i didnt likei like chipotle more than i like people
patkirchsucks,"straight edge, intersectional fem, ravenclaw, dog lover, & cheesecake connoisseur!!!! $mention$ is my part time lover and full time friend!!!"
CarolGuedes9,$hashtag$ // hip hop // invicta
kaitlynspotts,professional assistant in the academic publishing world. feminist killjoy. southern transplant.
emybabby,somewhere daydreamin'
JudeMal,"love being outdoors,taking photos of ...planes,cars,animals&nature-cropped only. enjoy e$smiley$loring new places too! too honest for my own good"
SimplyAmVanessa,"your average mom of $number$, nerd, runner, shy girl, writer, personal trainer and $hashtag$ coach."
homehelpers4you,"i am the owner of home helpers of ga & al. i am a certified senior advisor, certified in alzheimers care and geriatric case management."
BookTalkRadio,$hashtag$ $hashtag$ $hashtag$ $hashtag$ $hashtag$ $hashtag$ $hashtag$
powerpostpartum,"after being blind-sided last year with postpartum depression and anxiety, i am now devoted to helping other women and their families through the same plight."
AgentShawnee,"irl arale, mother of chinchillas, everybody's senpai, mutant, master of pressure points and moxibustion... and wearer of pajamas. pegasus relations $mention$"
ConstanceDeidre,"learning and development enthusiast, $hashtag$, $hashtag$ $hashtag$ $hashtag$ $url$ $url$ $url$"
verypink,"staci perry, host of verypink knits."
MsMahGrr,i dabble in all things great.
RockieShifah,dnt be sad because of people -they will all die follow me and i'll follow right back
flozimoet,i hate being the first to start a conversation.
xvbrenda,csulb'19
Fanta4Banta,$number$| poet|youtuber that doesn't do hijab tutorials. a flower does not think of competing to the flower next to it. it just blooms. $hashtag$
iam_almiskin,"$hashtag$ promotion of ur music, videos, admin in $url$d ii pro alesh hotel in`t $url$ contact: $number$"
Andrea_Michele,i take pics. i eat. i tweet. oh so uncensored.
mz_ASB,"$hashtag$ to earth..$hashtag$ taurean geh..$hashtag$ aboki ..$hashtag$..$hashtag$ i'm good i'm very good but when i'm bad,i'm better..$hashtag$ am me and wud always be....2a5fcf91"
Ms_Hilz,god chaser. cosmetic chemist (formulator). prawn queen. $number$ corinthians $number$ _ saved by grace.
Google_My_Boobx,"helloviewer,thou shall nt view my $hashtag$,viewers are liable $number$ get stuck.i am a threat $number$ ur tl,i tweet $number$ kill $hashtag$.i $hashtag$,i am a twerkfreak $hashtag$.$hashtag$ $hashtag$"
Erin_Taylor98,'16
israxm,actions and words aren't as loud as the blunt
RejectsDaughter,"i never thought i'd end up where i am today. wife, mother and oh yeah, queen of hell. $mention$ and $mention$ own my heart. $hashtag$ $hashtag$ $hashtag$ $number$+"
JessicaDavis136,"well, anything worth doing is worth doing right."
hartsyouu,know that life has a hopeful undertone. $mention$ is my favorite blessing
kaaliajay,as in wiz khalifa not mia // $number$$outh
happilygemgem,life struggles...i know right!
Woundylan,_2 fab $number$ give a damn_
gailyn_enos,thai native american hakuna matata instagram $mention$.lynn61 music & kpop is kinda my thing.
sashaapieterseP,"i am a $number$ year old english teacher a single lady who's grown up a lot. $number$'6 blond hair blue eyes, a pretty girl a different girl role play account only"
cyndihardyphoto,"wedding photographer based in both san diego, ca and phoenix, az. available and love to travel!"
notcunterino,$number$ | london | put my $mention$ in your suicide note
TaraBecker_QCT,cops and courts reporter for $mention$ got a tip? email me at tbecker$mention$.com
MaryArredia,straight outta franklin park
andrealanis,the moment you are ready to quit is usually the moment right before the miracle happens. brandlover | shoeholic | organdonor | $number$ndchancesbeliever | in_
francescafloris,"clean chakra, good karma. insta: francescaflorisx sc: francescafloris"
PattySomlo,writer.forthcoming books: the first to disappear (spuyten duyvil); even when trapped behind clouds (wido publishing); hairway to heaven stories (cherry castle)
BrittanyyDevies,success is peace of mind which is a direct result of self-satisfaction in knowing you did your best to become the best you are capable of becoming.
Lara7058,"entiende que para quererte, an me falta vida $mention$ benjamin jdb"
Alissamarie_56,mf_
Loveable7lerato,$hashtag$ am your majesty
justxwella,i am your secret duff
kellyanntrace,"human first. everything else second. creative mind influencing public industry. chief strategist at reach, a marketing strategy firm and hubspot cert. partner!"
prettybirdsam,"mom to $number$ beautiful girls, pr specialist $mention$, community champion, avid $hashtag$ football fan & usc alum, former pr dir for $mention$..."
indiemuke,i'm a lover not a fighter
Lauriehp3,"breast cancer awareness advocate, physical education instructor at lakeland community college with an ophthalmic tech degree, and a self proclaimed beach bum."
MaddyCote13,university of new haven $number$
cskolnick1,"i am a california real estate broker with over $number$ years e$smiley$erience. i am a certified trainer for the one thing, authored by gary keller and jay papasan."
kaymsee,here's to conforming with society.
Cecez_Daughter,love yourself like how kanye loves kanye respect yourself like how kanye respects kim. || rip zweliq
EvaDema13,"swiftie & whovian. potterhead & bookworm. feminist... well, egalitarian covers it. dw + got + twd + les mis. $number$/02/2013 + $number$/06/2015 _"
dreamy773,_ _ _ _ _ __ __ yo can ae yor ___nd anyw__ere yo wan o go. u _s o so_s sss s s ls
Ms_Terree,"terree rola is aiding & abetting chefs, restaurants, purveyors, & food-focused friends, with culinary news, deals & events. contact: $url$"
elijgc18,the world is mine
EsmarlyneG,dominican | ig - esmarlyne__ $number$/12/14_ a&e & m&h
MyLiveGirl,top live sex cams website in the world $mention$ ! be a $hashtag$ and play $hashtag$ with all the $hashtag$ girls !
filmnoirx,the only broken-hearted loser you'll ever need. $mention$
merylalper,"assistant professor $mention$. faculty associate $mention$. researching youth/family technology use, disability & digital media, mobile communication."
XUD_L,today's special moments are tomorrow's memories.
gjohnson2009,"luxury home realtor - personal touches, win-win deals & positive results. i currently service the lake conroe, the woodlands, conroe and montgomery area."
Tasha23Sexy,dig deep!
Deemabdulsamad,bitches ain't shit and they ain't sayin nothin..
trueprototype,"as people with the creative spirit, we're obsessed with possibility. we live for the rush."
maddy_Ch0,"by your own efforts, waken yourself, watch yourself, and live joyfully. bay area boulder"
skajingo,$hashtag$ $hashtag$ $hashtag$ $hashtag$ $hashtag$ $hashtag$ $hashtag$
urbanexpressive,vegan but not an animal lover. perm free & not a natural hair nazi. conscious of the black plight yet listens to future. i'm ok w/ my contradictions. are you?
daniellep__,$number$. o r l a n d o florida. $hashtag$
jnolos0708,syracuse university alum '14!! determined to be involved with the beauty industry bc every woman deserves to feel beautiful and confident!
twoshadesofhope,feminist killjoy. 'we do this because the world we live in is a house on fire and the people we love are burning.'
rachelwinter20,| i am f r e e |
dioplaflare,you can be whatever you want n*gga we all kings . sc - dioplaflare $hashtag$ $hashtag$
CPojero,awesome mom of $number$ amazing girls.
Rhaenyra24,love yourself and then love other people
soursparks,brownskin $number$ life
AMummysLifeNZ,real motherhood life at it's best and worst. new zealand based wife and mother of $number$. family life blogger and vlogger with a slight focus on perthes disease.
Drecka_Mia,legitimate faith_
evelynlovessss,graphic designer | letterer | romans $number$:28
19Barbara57,"the great enemy of the truth is very often not the lie - deliberate, contrived and dishonest - but the myth - persistent, persuasive and unrealistic. jfk"
GheiForTae,just because $hashtag$ $number$ ashley
the_author_,nerdy feminist with a towering tbr pile & a clingy cat. she/her. $50 up front to deal with asinine questions. all opinions are my own
pericolleen,shouts out to myself too
AshleyEadie,"sailor, skiier, graduate student."
RyunaSiege,$number$ y.o. porn starlet and maker. blonde and bi with a dagger tattoo on my thigh. find me at $url$. adult content. $number$+ only.
numin_a,"l.o..e//dai5y//17, map6 stan// polish dai5y&m.a.p.6 poland staff snap/ig/line: numin_a"
sallysizzle,"mainly use twitter to complain, what else could it be for???"
yannaluv_,csu $hashtag$ westerndove
unkindhorizon,their breadsticks are like scrapbooking
VyRTMe,shhhhhh... this is a secret account. doing everything here my friends won't let me do on my main.
itsme_dee,cali girl living in texas.
jessicagordon16,university of liverpool |
Shes_Adriannaaa,"i'm hood, but country at heart."
TaniaOnTheScene,"interviewer, host bookings, event coverage: email: taniaonthescene$mention$.com $hashtag$ radio tues $number$p blogger: $hashtag$ $hashtag$"
MandaFizzy,"it's hard to be a misanthrope and a romantic peace, love, empathy vegetarian | aspiring photographer | dreaming of seattle | captivity kills"
DebraFoxx,"jamaican born actresshostauthor of newly released book loving through thick &thin, a relationship must have. order on site listed below."
linddss4,wps
Kiley_J_Medler,i can do all things through him who gives me strength.
Jenniphr,the mind of the subject will desperatly struggle to create memories where none exist music | dancer | singer | makeup | $number$ | snapchat - jenniphrmcginn
angelicurIs,a heart of gold and boots to match
laura_brooke10,georgia rees is b_
TaniaOnTheScene,"interviewer, host bookings, event coverage: email: taniaonthescene$mention$.com $hashtag$ radio tues $number$p blogger: $hashtag$ $hashtag$"
SindyOriginal,hi i'm sindy i love ulzzang gyaru fashion makeup circle contacts and coffee : ) $number$
Jigga_OnHisLips,$number$ years old. i've limited my drinking to weekends . i build my $number$k on weekdays. colgate over crest. clothing isn't necessary and neither is tact.
sexysleepwear,yes i'm well endowed but in great shape! $hashtag$ $hashtag$ $hashtag$
victoriacha,if i die i'm a legend
AmberWhiteside,$number$
karlibunch,ovaries before brovaries
LaceyvanderHarg,$number$ | instagram: laceyvanderharg
its_melissa13,young & foolish
crayonx3,kpop trash/forever crying about tg/tgre:
Louiseandrews18,cheerleaderrrr
wuhobitoqoj,a census taker once tried to test me. i ate his liver with some fava beans and a nice chianti.
DrPalutena,just another extraordinary queer black caribbean woman. natalie.plant faerie witch . banana. not here to play nice. tired. $hashtag$ she/her fae/faer
undovictoria,new $number$ got me like
carol_shamel123,i look like i dont care but deep deep deep deep inside...i still dont care
CCCwright2,sheffield lake
emmaabossaert,$smiley$:
Christine_Sheaa,snapchat: christinesheaa
sunnydayhs,you have eyes my dear but you cannot see.
karenstrunks,i help people do what they love - no compromise | $mention$ network partner | i run $mention$ | get a free gift here! $url$
mcd0n4lds_,all our dreams can come true - if we have the courage to pursue them. - walt disney
nickieohara,"$number$ model, good condition (large scratch on bodywork), one careful owner since $number$. genuine mileage. full history available."
TheHollyJayne,harvard '19
luv_2mise,"am a guy of high esteem, hard to get but fun to be with ... $hashtag$ ... $hashtag$ ... $hashtag$ ... $hashtag$ ... $hashtag$ ... $hashtag$ ... $hashtag$"
sneeuw_hart,i'm not sure who am i.
Jade_DappysGirl,need start sticking up for my self!!
jenniferheu,yous a hater hoe n i'm a greater hoe
barbjp2015,dr. sears certified health coach yoga studio owner/instructor holistic healthcare practitioner
passion4savings,"i love sharing deals at $url$, i'm a mommy of $number$ and lover of all things social media!"
SXYVS,must be $number$+ to view this website. follow and mention for retweets. check out the hottest girls at _ $url$
tawny_ashworth,$smiley$
dionneomahony_,"barry o' flynn was my ginger!!!anne has a boyfriend/diabeto, $number$"
ImDutchessDUH,$hashtag$ this is my only active twitter) any form of art. is a form of power. it can affect impact. and it can create change
K3lllllyyy_,currently pregnant and thinking about my next meal
ashleighcaniff_,protect the sharks
RhemaVerses,"all bible quotations are from the msg, kjv and amplified versions."
reyyneyy,i have everything in life except chill
yetnaleci,basketball / amy is my bestfriend
minnieminzyminx,"a bit too cheeky for my own good $smiley$ (31, uk, geeky, quirky, also talks before thinking...bad habit i know but meh -_-) instagram: $mention$"
alexandria_x0xo,"think happy, be happy"
__AmorFiel,michiganarizona|biology at asu '18| never regret something that once made you smile!
TaniaOnTheScene,"interviewer, host bookings, event coverage: email: taniaonthescene$mention$.com $hashtag$ radio tues $number$p blogger: $hashtag$ $hashtag$"
lucyandersen_x,borlase
AmyWelshxx,"'beneath the make-up and behind the smile, im just a girl who wishes for the world' -marilyn monroe"
KayleighEU,"hey, i'm kayleigh. socially awkward bellend who plays games. dr pepper addict & hat films fangril. i play wow on eu- bronzebeard. emily"
nasheTL,"atrevida, dificil de captar el sentido, dificil de saber quin es, loca por leer, por ver, insolente, libre."
victoriacha,if i die i'm a legend
EdwynaCES,$number$+ years within $mention$'s student affairs departments. employment consultant | job developer | student advisement | second career
harriet_grose,"lover of all things travel, fitness, food and devon related! bespoke events coordinator $mention$ $mention$"
khel___,a woman with no vanity!
GlizzyLanie,dm(v)
cabEYomyeggo,i want you to do whatever makes you happiest in the world | $hashtag$
IAmKotah,"i dream to dance, to soar, to run and not look back. you & me"
briannaoftarth,"do no harm, but take no shit"
RosesAndRellos,daddy ain raise no pussy
isimplytessa,even when the night changes. it will never change my love for one direction _ _
birdemily_,"$number$. student. musical theatre, doctor who, glee and the $number$ idiots are basically my life."
lalenamonica,long island ny virgobabyy $number$ instagram: monicaa_lala younow:lalenamonica
Pegasus_Cindy,"i've loved big&rich since their $number$st song wild west show was on the radio! $number$st show march $number$, $number$ been living big & rich ever since! _ cowboy troy! _**_"
LousieAgnes,i'm a content writer & a $hashtag$ specialist who loves riding on a motorbike! organic $hashtag$ is my forte.
luv_oyin,"a girl of high esteem hard to get but fun to be with, cool, easy going, daddy's girl. $hashtag$"
LatterDayOtaku,"emma | $number$ | fic writer | ons | gangsta. shinya bias. delico bias. warnings: hyuuga junpei is my spirit animal, nsfw, not spoiler free. i'm really obnoxious."
TheGunnerfly,i love cats and arsenal.
Umuvugakuri,$hashtag$ how someone can ignore the majority of $hashtag$ -ans and self called democratic?
erinhemlin,"health care campaign director $mention$, all about higher ed, healthcare & youth jobs. also a little $hashtag$ obsessed. tweets are all mine."
ddinnawi,holistic health coach at $hashtag$; mom and wife
_Pappi__Chulo,child of god _ rih kina
cytaoplasm,he was contemplation and enthusiasm. ambition and strong coffee. i could have looked at him forever.
courtsapenguin,most dope
Gabeepie,ew
karleighblaise,kb ulm
stylescareful,"harry is the light to my day, every day"
_CelesteMonae,im not a princess i dont need saving im a queen i got this shit handled
AmyCrowex,instagram: amycroweex
angelagarryuk,"author 'brave pas' & 'the pa & ea circus'. editor 'nahpa' mag. world's most connected personal assistant, virtual assistant & pa trainer, coach & mentor."
JADESWISSROLL,dublin. general messer. i make nice things. $hashtag$. $mention$ | $mention$ | $mention$
ItsMauraaaa,$hashtag$ $hashtag$
martinemartin87,"i like my coffee, my life, my job, my shopping and my ability to tell it like it is. don't want my opinion? don't ask! married w/2 children."
pjongup,em terra de cego tyson reina / $mention$
KimberLofgren,coney island girl.
Morgan_Larry43,ahs
jojoseames,"illustrator, comic book artist, painter."
Nae_Folarin,nemo's mom $hashtag$ still $hashtag$ $hashtag$ $hashtag$ something like a celebrity
MagdaLenA_JT,"just because we can live without something, it doesn't mean we have to. $smiley$ // justin timberlake // danny o'donoghue $number$-05-2015"
NenRosee,ig: $mention$
Roxyfighter,"the happy warrior. contestant on the ultimate fighter season $number$. invicta fighter out of syndicate mma gym. former english teacher, current grammar police."
AlhenaSmile,$number$. historian. spanish. globetrotter. i love london _ ramen & tomato addict. tea makes me happy. damsel in shining armor. proud member of the cumbercollective
1THERESE064,"chocolate doesnt ask questions, chocolate understands"
Tirah_Gaines,(tie-rah)
fatinizuki,"be strong, theres a long way to go | $number$"
eyeisrobin,what do you call a sick eagle? illeagle
KatieReeed,movie watcher | college goer | tami taylor appreciator.
EHarrisonAuthor,author of all for the love of josie and a troubled soul. available to download via amazon $url$
HannahhMartinn1,$number$. showjumper. surrey .
DAndraMc,$hashtag$ $hashtag$ transfer from ny
carlla_XOXO,mojo
ParkersRoom94,"unionj_room94_twfanmily_the vamps_benhaenow _olliemarand_ $number$sos_ollymurs_nathansykes_not all hero's wear capes mine are tomparker,kit,kieran,dean,sean"
Michelle_cilley,truth is that no one can replace me
nkrentz,"graduate student in lynn lab at cfri, whitecaps fc supporter, runner and avid tv watcher."
violentdaylight,"imperfection is beauty, madness is genius and it's better to be absolutely ridiculous than absolutely boring."
Ceyda_Ramadan,$url$d
MayceeSteele,"when life throws you a curve, swerve : mayceebug"
gzbchrist,"when i'm hungry, i eat. when i'm thirsty, i drink. when i feel like saying something, i say it."
yourpotofgold,sahm...enjoying life one day at a time en este mundo divertido! i like to use some spanglish. enjoying this new twitter thing... let me take a peek!
Khaleesi420,"a fire bending, harp playing, troll converting, blue haired fairy. (18+ only, camgirl) $url$"
cannedallison,cheetah print enthusiast and whistle tone extraordinare.
reut899,"msp digital sales $mention$, cloud, also like: dogs and fashion"
nabilahendricks,islam.
celeBRITTi_,"i pull at the club vip, gas tank on e but all dranks on me"
LosingMuke,michael clifford makes me smile
ObsessionOfMe_,i am a queen | fl | my aspiration in life is to be .. happy _.
fryof_thecurlys,to get to success it takes pain i'm just the cool side of the pillow everything happens for a reason future deaf education major at usm__
Ty_kay,gsu alumna clevelanta_
blackgirldoctor,medical student & radio show host.
EiseleKaren,$number$+ i am simply pretty and sexy girl i can be naughty sometimes or obedient just tell me about all ur crazy fantasies and lets play together.
AnnaellYon,"cameron,nash and hayes | god has a plan | s o l e n n | snapchat and insta: annaelle_14"
violentdaylight,"imperfection is beauty, madness is genius and it's better to be absolutely ridiculous than absolutely boring."
SheldieDerival,ig:heslergirl19
jayyalexis_,protect your magic x $url$
MeganAbridged,tweets are my own--no one else would claim them
MusicBoardAlex,"$number$ - art institute of denver - bisexual - avid music listener/student - single - way too many dreams, literally no time."
vanitynosin,welcome to veegarden i'm too good &i'm true -$smiley$ your modern day hippie $hashtag$ $hashtag$
Reallifee_Jamie,jamie aleksandra htx|photographer| meant to be said-so i say it anyways bukowski fan music enthusiast russianamerican.
phoebemakeup,"celebrity makeup artist, beauty blogger $url$"
Boogie_Biggavel,mrs. dixie to you hoes! . jace's mum . free my baby loveeeeeee _
unicornashtonn,i like tacos.
jadequeenxo,$number$ | scottish | $mention$ _
janewheeeler,new delicious shoes added everyday! yummy!
carlton_lacey,from the $number$ to the $number$ _
loraniemckk,ig: lorainemck._ | snapchat: lorainemck _
weirdboo,internet trailblazer. analyst. social media fanatic. amateur food practitioner. travel specialist.
hatwell,"british idiot in new england, beers / boys / bikes"
PotentialModel_,$hashtag$ ig$smiley$tentialmodel_ asu $number$'
khendricksss,born again twilight fan baby
LishaLynz,reallyhighideas$mention$.com
AlysaARice,journalism | fashion | $mention$
evil_matriarch,"queer poly nb trans tomboy/lady. vegetarian indie hacker writer musician. agnostic jew; amateur buddhist infj, $number$w2 $number$w5. you can call me elle. pronouns:"
VickyGShore,"mtv reality star: geordie shore, ex on the beach and judge geordie! for bookings/enquiries please contact gemma wheatley: $mention$ gemma$mention$.com"
so0fetch,"i'm a mouse, duh."
xKumosha_,"the pain you're feeling, cannot compare to the joy that is coming! $hashtag$, $hashtag$ fly high!"
NathanIsLife1,"$hashtag$ $hashtag$ max george follows & nathan rt, fav & mentioned tom parker follows jay faved nathan followed $number$/11/15 kelsey follows rachel followed"
aleyda_mejia,ig: aleydamejia
JenneySandy,"your past does not define you , you are not a prisoner of your past , you are free in the present and unstoppable in your future.. tax question ill help you"
SkylarSkyy__,when you pretty & unbothered $hashtag$ | july $number$996 _
colleen_hoffman,"your skinny wrap girl! math teacher to the stars, mom of the best munchkin ever (dare you tell me different) and if you ever want a cupcake challenge - tweet!"
MisisipJns,$url$
kristiagraham,"photographer, traveler, aspiring writer, hardcore film/music fan. outdoor enthusiast. animal lover. gypsy. everywhere & nowhere is home. grieving mom. $hashtag$"
starrygogh,do you believe in time travel?
shelby_1018,whs'19
Aewallace8,principal of pocomoke high school. views & opinions e$smiley$ressed are my own. retweets are not endorsements.
Audioslave1974,sticks and stones may break your bones but words cause permanent damage
TinaCamp444,*diehard*philadelphia*sports*fan* allstarcheer-soccer-lax mom/wife certified*court*reporter $hashtag$
KaileaHarrod,"wild hearts cant be broken, fl"
Jelleezus,delightfully mediocre. coloured. afrikaans. what you think of me is none of my business.
JenneySandy,"your past does not define you , you are not a prisoner of your past , you are free in the present and unstoppable in your future.. tax question ill help you"
mooglemeg,proud member of team$mention$ $mention$
mackentosh5,i know the sun's still shinin' when i close my eyes
NoCheeeeeks,"sitting in a chair, but in the future it's a throne. titans mommy."
meganguzaTrib,"mayhem reporter for $mention$. $mention$ & $mention$ alumna. washco native. dog mom and slopes dweller. rts aren't endorsements, etc etc. mguza($mention$)tribweb(.)com"
CianaMileah,life is gr8
anahansentweets,"if you like home living and interior design, please follow. i add new stuff every day"
Mia_theGreat,probably writing in a notebook somewhere // blacklivesmatter
PMouseyCards,"handmade boutique chic cards in austin, tx $hashtag$"
kcbeasley1,health and fitness coach at beachbody
_dxcabrera,$number$ | ucsb '17 | $hashtag$
WVPugMom,"cpc, ahfi pug mom, conservative christian voter & lover of free speech. protect borders & deport illegals. laugh often - life's too short"
Trill_On_Molly,_ig: imabreadwinner_kik: dennietrustnone_ _snapchat osodennie
anaisnin,"i write short fiction, and stories about italy. i take dreamlike photos & study french $hashtag$ $hashtag$ $hashtag$ $hashtag$ $hashtag$ $hashtag$ $hashtag$ $hashtag$"
kimmybanks16,pray the real live forever
TheRachelHonza,i found my life when i laid it down
KISSmyMAC,thug. former stoner. hairstylist. ig: $mention$ $mention$
Lotte_IWill,"ceo of step up to serve, the organisation that runs the $hashtag$ campaign. i believe young people can change the world. $url$"
V_e_e_e,believes
thegirlontop,"$mention$ $hashtag$ e$smiley$ert, bestselling $hashtag$ of $hashtag$ & mom."
MadelineClarice,blessed.
Claire_Limbert,i am a cider drinker...
AkuaAllrich,living and loving through my music $url$
MolefeNthabs,"woman, daughter, sister, friend, aunt, politician, student, mentor, leader, simple, passionate, loving"
ChiefFrugalista,writer and travel blogger.queen of the one bag trip and having a first class trip on a frugal budget.also at $url$
sammbett,i probably dfwu
_insideout_oreo,"god girl|| ghanaian-swiss mix,with a dash of south african."
txylorbaker,savin lives n shit
juliarraymond,professional food dabbler. $mention$ co-founder. everything else tbd.
sharpeswans,a writer for many bitchy muses.
moonlitebuterax,i luv breaking the rules
laurenhalteman,jbb
RachyyJ_,$number$ // i.g - rachyyj_ // snapchat - rachyyj96
__nishaaaaa,ii_brandon!
pAris_intheFall,__$smiley$$smiley$$smiley$$smiley$ __
