WilfordGemma,ricky wilson the best frontman/kaiser chiefs the best band xxxx thank you kaiser chiefs for an incredible year of gigs and memories to cherish always $smiley$ xxxxxxx
monroevicious,you don't know me.
pigzilla_,pll fan // crazy about mcd // ramen is bae
GabrieleNeher,"renaissance art historian, university of nottingham; fuelled by haribo, partial to coffee and with a soft spot for renaissance china. national teaching fellow."
Toucaan_Samm,jmkm_
jlpeter37,"artisan specializing in paper mache, print-making and fibre art. art teacher and cat devotee. find my page on fb $url$"
SarahMaddry,he bled and died to take away my sins
bethleia,union j xxxx
karenhbullard,wife to my coach. mom to my eight troops. follower of christ.
DearMoonshine__,my dms closed. | sc: dear_moonshine
sarahamiels,self-proclaimed princess and occasional pain in the ass
__amira_,penn state alum $hashtag$
alexandraalice,slightly ginger with blue eyes. park run _
llIUMINATlRESMl,goodmorning mentions anyone !! $hashtag$ must follow back $hashtag$ for a follow
cheer_diva97,i like to sleep
BURNSlVAN,ask no questions and you'll get no lies $mention$
Moonfell44,"born in czech republic, live in ireland, wanna be in germany. ouat oitnb"
Miss_Masaya,retired bad girl. queen!
RAEHEREEEE,walk by faith not by sight.
AngieMozart,"wife of tidy boy amadeus, director of the ideal place and proud mother of max mozart"
BuzzellNatalie,a lie gets halfway around the world before the truth has a chance to get its pants on.
YemiSureGirl,calm and collected. $hashtag$
angie48534918,"hi. my name is angela but most of my friends call me angie. i have a very boring life consisting of college & work, so i have nothing to post for a bio."
Madelineh28,charity volunteer
ilovegiraffes_,i only trust people that like big butts. they cannot lie.
LmarieAsad,community outreach. medicaid managed care board member united way chicago m.a. gerontology. advocate for underserved communities. isu alumni.
AliciaVRuiz,ventas digitales $mention$ ibm espaa. todas mis opiniones son personales y las hay de todos los colores. tambin puedes contactarme en $url$
thepanda_karina,"f ', ', p f' '"
sh4nnonmiller,you're a catalyst to your happiness
mill_isit,|studying at dillard university| |dr.williams|
Mydickboyyy,leonel dominic
ArdithBordonaro,"how to quit paying for e$smiley$ensive medical visits and fake fixes, and eliminate his frustrating, nagging and constantly repeating low back pain."
DianaTsang1,your brain is that bodily organ which starts working the moment you awake and does not stop until you get into the class.
iSpeak9ja,no $number$ $number$ja online gist | entertainment | news | musics | videos | events | celebrity focus | interviews | life style | fashion | $hashtag$($mention$)
kilpatrickeolue,it hurts to let go. sometimes it seems the harder you try to hold on to something or someone the more it wants to get away.
kayadfi,"just a girl in love with god. pole vaulting, lifting, reading and horseback riding are my passions. country loving small town girl!"
SouthAfricanEQ,the island's official magical creature || omg you can't just ask me why i'm white || avi & header are me || $mention$ & $mention$ ambassador
constanshow,train like you've been picked for the hunger games
ponder76,"$number$ year old married broad. makeup artist,stylist. raising to $number$ beautiful girls to be strong beautiful women.wife to a roughneck"
msrainerain,"$number$/creolemixed/borninneworleans,raisedintexas/love god,family,friends,education,$,sleep,text,food,movies,music,clothes, makeup,nature,animals & colors."
LouanneGaffe,"hi ! my name is louanne , i am great fan of justin bieber and i love you ! *o*"
jenkoons,national security & foreign policy editor $mention$. pulitzer crisis center grantee. former qatar e$smiley$at. medill grad. retweets not endorsement.
colltreese,"writer // stoop hen. into books, punk and gin. writes for cash at $mention$. working on $mention$. foul mouth cyclist."
dam3_un_beso,"sick from the lips, caramel wanna try it? $hashtag$ $hashtag$ the perfect balance between badass and feminie. di hempress -empress;"
ellpennerz,finna be lit. vancini
brxwnlouise,insta: brownlouise
TMT_French,tammy r_| sc:kredo3x |
briteveprice,"i love jesus, miranda lambert, jle, leopard print & a little jack in my coke."
CristyMandy,"se un uomo non disposto a correre qualche rischio per le sue idee, o le sue idee non valgono nulla, o non vale nulla lui (cit.)"
PegueroM,$hashtag$ $hashtag$ $hashtag$ $hashtag$ $hashtag$ $hashtag$ soy liam girl ig$smiley$elly099
sydeischens,soco '15 i randolph college '19 l it's so hard to leave until you leave then it's the easiest goddamn thing in the world
Ashlee35900,lover of all outdoor things _ subtly charming geek _ massage therapist _ mindful
blaaaakey,sure fine whatever
noragamis,eo soo seon my smol
ATriptoArete,author of the novel a trip to aret
AdrianaDuji,"|love is like a car accident: they hit you and you fall, and then you survive or don't survive.| |we love each other cuz our weakness are the same.|"
Varsha_Nair_,"i'm $number$. love singing, dancing, food!!!, painting, tom bertram!!!!lol i'm awesome like that!!! i am a viner go follow me: _|_varsha_nair_|_"
ruhtyt,naturally and artificially flavoured
too_blunted23,carla maltos _iixii
scandaryl,"hey norman, how did andy's dick feel? (click on link to find answer)"
oliviamockford_,instagram: oliviamockford
sighs4l,//time is a ghost\\
micewithcigars,sagi babe
dxniellejean,all i do is complain and get drunk
_azieyazieyzah,_ muhammad fitri adam _
JaclynAnneD,"aba instructor, grad student, couponer, deal-hunter, freebie-snatcher, blogger, iphoneography lover, and social media butterfly"
oceantay,ed $number$/5/15 taylor $number$/17/15
3IRIS6Miranda19,i will go into survival mode if tickled
normaniser,get me a normani video
RhiannonDarling,fuck it is dummy
abz_absz,abbey gilbert $mention$: we are all work in progress.
cemberlii,i like to call myself a writer/// melanin+curls/// pro woman+pro black///reader+blogger
ce_2chocolate,mommy to ka'leighceriyah_
JRaquell_,$number$ | good vibes only \( )/
ArdithBordonaro,"how to quit paying for e$smiley$ensive medical visits and fake fixes, and eliminate his frustrating, nagging and constantly repeating low back pain."
kellycarberry,love to read favourite book series is fifty shades of grey fan of stephen moyer and jamie dornan love watching true blood big rookie blue and $hashtag$ fan.
MaryanneBigTi,$number$ + only ! big-tits pictures from my site .
Lea_Maria__,"swiftie forever & always / i'm $number$. i the script, cats, music, traveling, tennis, basketball & ice skating / i can play the guitar, piano & ukulele a bit"
leechjgena,"if relationship can't survive the long term, why on earth would it be worth my time and energy for the short term? $hashtag$ $hashtag$ $hashtag$ $hashtag$ $hashtag$"
Savvyheiden,wasted
NotAnthrFangirl,*waiting for gandalf to come to my house and invite me on an adventure from which i will not e$smiley$ect to return*
allthelowex,hey angel.
ewclayton,please block me
n8taki,just a small town girl convinced that she was born on the wrong side of the mason di$smiley$n. started $number$9.13
feminist_ghost,spooky bisexual teenager + intersectional feminist $number$/7 (was $mention$/feminist_kid)
bjbernstein,"attorney, speaker and legal analyst $url$ and $url$"
definitemutter,communicator. coffee enthusiast. infuriatingly humble music nerd. subtly charming internet guru. alcohol fanatic.
tikaudzu,just a girl wanting big things out of life
usa_ella,any questions?
_allisoonn_,$hashtag$
AndreaM1969,life is not about waiting for the storms to pass. it's about learning how to sing and dance in the rain.
Kar_M12,"get what i want cause i ask for it, not because i'm really that deserving of it"
SianChristinaK,damn the man. socially awkward extrovert. ig: sianchristinak
HelenLuvsVSPink,~hail to the moon tell your father your friends you cant lock the door cause shes already in~ig: $mention$ life saver & manager of $mention$
SKJtraveler,"traveler, writer, b&b host, beer drinker, kitty petter. independent travel, off-the-beaten track, and volunteering. $url$"
LeveragYourBook,an online writing school with top instructors and great classes at affordable prices.
_laaumake,$smiley$.
kaebitb,apple freak girl and love games
snlz0,hi ^^
shirleyymoo,food fanatic. incurable troublemaker.
DeniseCassino,web marketing e$smiley$ert specializing in book promotions.
amandacleghorn,"follow me on instagram: $mention$ -- taylor swift dancer, sytycdc top female"
SherryBabie,"mom, currently divorcing, & comic. crohn's advocate. dr. phil social media contributor & member of inner circle."
steph_the_sloth,like to do fun activities $hashtag$ $hashtag$
janinenatt,student at university of cambridge
Rajna_Hussain,older than you think $mention$
damronburgundy,i enjoy weather.
mriannaburrayxo,instagram// briannaamurray
jb_winchester,follower of jesus christ. lover of life and people. enfp. starbucks partner.
sileaswarwick,eat healthy foods to stay healthy
DzifaJ,"pr professional, writer, thinker, fitness enthusiast, football lover, angostura rum & fc barcelona"
mkayla_bayla,-glenoak junior//just a young girl trying to make it out like everybody else//
dianagoodmans,you miss $number$% of the shots you don't take - wayne gretzsky - michael scott
Perksofbeeing,"in bianca's heart, mind and soul"
meashy_c,cheerleader. cat herder. den mother.
Iaurensmith,$mention$: $mention$ your like the only one on twitter whos funny of course
iAmRoxyAyala,dj | creative director | visual artist | social media coordinator & $hashtag$ | stylist | youtuber bookroxyayala$mention$.com | instagram: officialroxyayala
Julez_afrique,|african| |proudly nigerian| |fashin mdel| |agricultural scientist| |change seeker| |feminist| basically a rockstar
Sammy_Jenkins,$number$8.14
julieweigley,"writer. beautiful but unlikely ($url$), the mojo collector ($url$). is that a good thing or a bad thing?"
mrsvwashington,"god $number$st, my family boxing and muay thai.. your only as good as your word, actions speak louder. snapchat vwashington3"
thisdreamsalive,"wanna save the world, don't know how..."
charliarceo,sc: charli_paige
anabellxox,my old account $mention$ locked me out ffs
anayeli_garfias,"i am a feminist latina, an immigrant, an activist, somewhat of a socialist--a marxist? i believe in fighting for others' human & civil rights...united we are $number$."
royalty1214,"rip to my lovely angels lulu, yamil, montrico"
Roxy__Foxy_,"quiero un amor bonito, de esos que te dan mariposas en el estomago."
sosocy,"woman who despairs with ignorance and bigotry, likes talking and apparently is quite good at it. $hashtag$"
QueeenPeach,the moon's love child . ig : majinpeach
Fahima90,"fahima was born in the village of harlem, nyc and is a producer at-large for pacifica radio; works as a consultant and is an adjunct university professor."
Italiataff,"former cabin crew,llb(hons)sportslaw phd student,married with $number$ boys luca & mico. writing $number$st book.wheelchair user"
Iindaikeji,lagos
disownedlrh,sunsets and adventures
totally_tay113,she is clothed in strength and dignity & laughs without fear of the future. -proverbs $number$:25 ughs class of $number$. uw madison freshman.
NancyLei,proud wife of american hero combat wounded vet usmc major james frederick wilson. supporter of human rights & injustice. step-mom. animal lover. hiippy adjacent
AsianSweet_,rip bean the good and bad die! carry on......
MaliciousWitchy,james bond doesnt have to put up with this kinda shit!_ i love $mention$ more than life $hashtag$ $number$3.15
xtnjav,ct
wootannnnn,\_()_/ / wwu / $mention$
klewisd3,i believe if you keep god first then all things are possible.
Georgiann3990,social media junkie _ love travel photography _ actor _ lake lover _ startup adviser
dollyymangoo,$hashtag$
BarbaraJoScott,asst. professor + chief marketing/communications officer + consultant + artist
Kerry_Louise993,birmingham
patriciabragg,"ceo & founder of bragg live foods, life extension nutritionist, author, health crusader,speaker and nutrition adviser to world leaders and hollywood stars."
guruchelles,"passionate about equality, feminism, fairness. labour member. pro-corbyn."
notcunterino,$number$ | london | put my $mention$ in your suicide note
OrganicExpert,organic noshables & other sundries ~ marketing & pr pro instagram: $mention$ :anitamariegriffin$mention$.com
izzyhardisty1,"$hashtag$ $hashtag$ by alfie deyes,quisha & beckii photography adictone direction & you tubers"
kdollaaaz,my hotline never blings
caryanne_,$hashtag$
breeeannep,~some just have to chase the sun _
jaygetsweird,$10 a month. thats like $50 a year.
Esther_Kores,i've started to turn into such a fangirl since i joined you crazies here $smiley$ troyesivan_grantgustin_r5family_potterhead_coconuterforlife_
theylovintea_,smile at them while they frown at you _
osnapitzgracey,chanel $hashtag$
BaileysEZPicks,"ez to read, hard to put down"
Beverley3918,christian | laugh snorter | camping fan | hair stylist | slightly enchanting alcohol ninja
KristineWyllys,author. lover of antiheroines. unapologetic geek. brownish. smasher of smartphones and the patriarchy. the roof is not my son but i will raise it.
Bulah957,teacher football lover reader
illyill,my jeans have pockets.
serenefrancesca,in love with montrell broadway
arianapeaceful,focus
SarahMarie0605,eye rolling my way into ppls hearts since '96
peaparker_,a lil vegan studying science // ig: peaparker
loriewalker,$url$
Jls_ca,"family, soaps and football here. $number$% of my tweets are soap related. enjoy!"
sorayagarcia85,"me encantan los perros, la naturaleza. soy buena amiga, leal, fiel, entregada. amo leer, imaginar, pensar!.."
t_thombs,"love you forever zrg $number$/121714 - when the power of love overcomes the love of power, the world will know peace. $hashtag$"
mindyvonelling,professional dancer turned lifestyle blogger at loving life in color
TerryNova_,i'm is a czech adult model and pornographic actress with $number$-inch natural breasts currently livin in london. you can follow me and retweet me every day$smiley$ luv u
lilstu76,i'm an airhead! lol you can find me somewhere by the yellow brick road. $smiley$
katheyy_,sc: princesskathey
Criss16_,[$hashtag$ $hashtag$ $hashtag$ $hashtag$ $hashtag$ $hashtag$ $hashtag$...] $url$ i'm still laughing. $url$
NotI_SaidTheCat,fine ass soul snatcher. soft spoken ratchet. photographer. lover of all cheese fries. snap: noti_saidthecat
sgraver13,parkland $number$ || la salle university volleyball
beccagraceface,| i'm here for the food | mu '19 |
cassaaandraa_,rest easy carlitos.
just_playsoccer,life's too short to even care at all | $hashtag$ nursing major | k | jazmyn is the twin _
KirstynBerkey90,quiet. artful dodger. lefty.. $hashtag$ $hashtag$ $hashtag$ $hashtag$ $hashtag$
LisaMcCall,"i live in sunny wilmington nc, i'm an ambassador for the wilmington chamber of commerce. my husband and i also have a second home in the suburbs of pittsburgh."
srzjwalters,"gifted and talented admistrator environmental science, artist, gardener, $number$ sons, born/raised in new orleans..gone global"
EmilyBaptista96,free spirit with a wild heart
chefyazzy,great white sharks.
SLukitomo,it is what it is
KarinaSanz07,"fue en ese entonces cuando dej de huir, porque me di cuenta de que era la nica que me segu_a."
heather_wicker,everything is a-okay coolio beans
PreachySnow,you'll decide for yourself.
Smilodon48,_____ || ____ ||
DianneDyconte,"accident and crime scene reconstructionist, loves animals, supports several animal rescue charities."
l0venadaya,wavy
mikster,"community builder + connector. rescue dog collector. ucla, $number$ers, whiskey, tacos & tech. doer of things: $mention$ $hashtag$ | $mention$"
Raya__Lovers,"this page is dedicated to the amazing presenter,host,interviewer $mention$ _"
TreaTrizzy_,god is within her she will not fail
hangingsliders,"writer with focus on sports, sports law, gender & sports. work found $mention$ $mention$ $mention$ $mention$ among others. find me at hangingsliders [at] gmail."
lizzyschultz98,sofo '16
dimplesdiaries,digital assistant and blogger interested in luxury fashion and sustainable design. dimplesblog$mention$.co.uk
nightmareinpink,i'm sick of the same. i want different.
bgg2wl,fitness fairy godmother. nasm-certified trainer. award-winning writer. $number$lbs lost! $mention$'s wife. i sneeze on the blog and the posts get sicker. $hashtag$
YeahDirectioner,"$number$ & from germany || bands, tv shows & youtubers"
Rasmika7,"huge fan of doctor who, reader of books and writer of stuff. future novelist and full-time procrastinator. i really am just a mad woman with a pen."
MsAdlerIPresume,"cumberbitch, $number$. this is my $hashtag$ account so if you're not here for benedict or sherlock, you're going to find me very boring. saw hamlet oct $number$."
MisBritBrit,follow me on instagram $mention$
adrianarraquel,"one $hashtag$ $hashtag$ player. lil ms f*ckin' sunshine. gimme: beards, geeks, cats, coffee, 'n bacon! yes, i awesome farted. oh, pirates! |[joopiter$hashtag$]|"
MsCoMpliCaTeDTK,$hashtag$ $hashtag$
Eternity9,walking away... $hashtag$: gpeternity
TerryNova_,i'm is a czech adult model and pornographic actress with $number$-inch natural breasts currently livin in london. you can follow me and retweet me every day$smiley$ luv u
42HERMINIA_Hail,mermaids dont do homework
Irakiennex,my _ is in iraq | iraqi-armenian $url$
_PrettyDessiy,rip carterrio johnson
cmstenko,hi let's be friends
mtrychon,wsu '19
NadiasArtistry,paradigm $hifter. follow $mention$ order the iconoclast $mention$ $url$
ElizabethApril_,i want you to ask yourself what you can accomplish given new and limitless possibilities existing beyond the scope of this meagre reality...
averytheloser,excuse me.. i got $number$/10 in a spelling test once
alessia_bosch,i'm a dreamer loving life & goodness of people. i'd like live on countryside encircled by my pets. i write poems & i'll read its only who'll be in my life
EmilyKitchingx,"$number$,hull, bands'n eminem"
xAigueMarinex,sina | $number$ | costume artist | singer | chief editor of $hashtag$ | german ambassador of scg
SindyOriginal,hi i'm sindy i love ulzzang gyaru fashion makeup circle contacts and coffee : ) $number$
sabryvassao,take me back to the basics and the simple life.
noscriptomylife,"a product of grace in search of everyday graces. a sometimes sassy, but mostly southern woman who loves jesus, life, laughter, and lattes. {extj}"
sin_thetique,"ilona horvath. business woman, musician, and artist of all kinds. let the beauty melt your soul."
xxxhoz,"i love to fuck a lot , am straight and lesbian . both boys and girls are welcomed .. follow and dm me for contact.."
tknolan,director of global brand & business development $mention$ former yacht queen $mention$
laniebug62,stay focused & extra sparkley || chs
HeatherMallick,staff columnist for the toronto star. i write saturdays in news and mon/wed on the five neat guys opinion pages. email hmallick$mention$.ca.
Samajra,"growth hacker nerd & online marketing manager at $mention$ (vionel). also a foodie, gym junkie and notorious traveler. blogs at $url$8"
jmhomeniuk1,$hashtag$ born on the prairies but my heart is in the ocean. $hashtag$ $hashtag$ $hashtag$ $hashtag$ $hashtag$ $hashtag$
Ms_Kushington,peace...life...love...freedom...music...r.i.p. ashley mccrae...r.i.p. kk.....$hashtag$ $hashtag$ $hashtag$ $hashtag$ $hashtag$ $hashtag$ instagram: ms_kushington
courts_fellows1,$number$yearsold.
EverjoiceWin,defender of secular spaces. feminist. sometimes a writer. sometimes a reader.
MegMckly,i'm so glad that i live in a world where there are octobers.
FresaLinda_,"$number$%puertorican, love to dance and play guitar. music means a lot to me. $smiley$ ____"
ashleyy_morrris,chs | senior | thespian
kodalinarry,~ you're like an imperfect poem or an incomplete piece of art flawed but still flawless ~ access to nj&lj/4
winterstole,$number$(04) $number$ $mention$ is mine
mrssavageangel,sahmama of $number$ just trying to figure out where to go from here. slimming world $number$ stone loser $hashtag$ & $hashtag$ with a dash of $hashtag$ thrown in for fun!
queenkandis,"i suffer from too much pep. i needed a pep outlet. loves: genre fiction, tv analysis, liberal politics, wine. contributor at $url$."
FaithfulFeat,"a happy wife, mom of $number$, blogger, functioning on jesus and coffee!"
__TrulyBlessed_,"struggles build you, not break you"
a7wright,god. love. yoga. health. luxury. || washingtonian in chicago || hoya & bison || trying to balance my lawyer half with my yogini half
BeckieNye,$url$
mxringring,i'm basically just phan trash and i tweet about random shit k bye
hannahfalsen2,$number$
Bees_Circus,"wife to colin, mama to daniel kyle (12.04.10) & joshua reg (17.06.12), blogger, amateur photographer, teaching assistant, reader, teaching student & painter."
smoosh_xo,the lightskin princess | mixed chick | fifteen | proving them wrong | ashtin cade foulger _
helenelafleche,entrepreneur | $hashtag$ professional | twitter & $hashtag$ marketing $hashtag$ | beginners guide to twitter recruiting. $url$c
retroafter,designer. web professional. internet fangirl. netflix addict.
xlyssawho,mean girl
RyFairfax,probably somewhere with $mention$ stfx
Ashlee_Ketchum_,white girl phenomenon under the guide of $mention$ | youtube vlogger in training | super smash brothers addict | college senior | $number$ |
SierrasSL,homemade cake jars est. june $number$ $hashtag$ $hashtag$
marrrriisoll,"lover of life, lover of christ"
OhThatsCAMP,scorpio season is among us $mention$
MichellePhan,full time dreamer + vibe master _
shypunks,$mention$: $mention$ ur my chocolate donut
kmullins93,pizza
Troubled_Ink,"bite me (sv rp, telekinetic, bitch, $number$+)"
B_blagowsky15,nothing is better than knowing we have a lord that shows endless love_ uiw volleyball
Cerys_Ruth,"burning down the highway skyline to the '59 sound. pulled by gravity, saved by wonder. contractually obliged to point out that opinions are my own..blah blah!"
Naosouaines,$number$//megan fox//halsey//b
suptine,golden
DashsKouture,"fashion student | if you follow, excuse my kimself. email: celinek.contact$mention$.com $hashtag$"
bails_420,bgsu19
AmberMariee22,instagram: amberdear22 $smiley$
maggiedavies,deputy director of nursing $mention$. florence nightingale foundation research scholar & phd. $hashtag$ & $hashtag$. all views are my own.
brittevvv,kanye attitude with kanye feelings. $hashtag$
MichelleKIRO7,morning & noon anchor $mention$. raising $number$ boys w/fire fighter hubs. $hashtag$ $hashtag$ $hashtag$ ig: michelle_millman fb: michellekiro7
kfanning44,student at lbcc
Jeaanetted,aaron
LordeBethGrande,take me back to the basics and the simple life
TheJenMoody,"business-minded, stemcell geek working at ccrm. tweets represent my own interests or views."
Kablappy,"an introspective young woman with a strong connection to the earth! an artist, professional animator, baker & gardener who dreams of an eco-community"
ayalamoriel,"perfumer, time-traveler, olfactory story teller and educator. connecting people to their senses since $number$. author of foundation of natural perfumery."
HannahSowders,constantly in the mood to talk about beyonce and pizza rolls
hawkgirl_kane,part goldfish. omnipresent in time. bedouin. ig:jaybirdhawk $hashtag$
megan_memo,bio major $mention$ bgsu
kushLOVER_xo,"i don't trust nobody , it's like an instinct ."
AliceMagee,"happiness can be found, even in the darkest of times, if one only remembers to turn on the light $smiley$"
mary6god,don't be afraid to live... $mention$ followed. love god. $mention$ followed ily _ $mention$ $hashtag$ $hashtag$ $mention$ ily _ charlie
bex_eli9297,just being myself for once and enjoying life as it comes $smiley$
giulia_venir,"veni,vidi,vici"
m_mawiskiee,"ig, $mention$ // rip nogood_"
samberlyy,dark and bitter with a spoonful of glitter. $mention$ | matrix | otaku
TatumMiranda,michael greenwald / endorse management $number$-614-6545
lilanotlila,word up
TimaBdair,fashion lover. photographer. dreamer. lover. beach bum. traveler. adventurer. stylist. blogger. lebanese $number$s girl
delalinme,me.
aprilmacie,i'm a comic & i like taking pictures in my panties to fill the hole in my ego where parental love should be.
35JOAN_Ansley02,are you a banker because i'd like you to leave me a loan
grvnch,momma didn't raise no punk ass bitch // $number$4.15
Sensbabe55,| $number$ | nerd | gamer | movie buff | ottawa senators fan | blue jays fan | animal lover | photographer | designer |
Espinoza_Abby13,_ god first ig: __$smiley$ae
bossychick87,gemini. _ i am my brothers' keeper. i'm tryna do better than good enough... amor vincit omnia $mention$ is bae
happykortney,"head in the clouds, feet on the ground. $number$ _ _ t$smiley$t"
Peggy_Kittyxxx,i'm a lady on the streets & a freak on the bed. $hashtag$ with a wet pussy and libido. my $hashtag$ are for sale.
chrissyATC,"chrissy costanza is why i made this account, the reason i wont leave are the other fans."
chawklatygirl,muslim its my birthday month.. wish me on $number$th.. afridian gauti
RozayyASnob,lost my brother from my other mother.. fje vi.xv.xiv if this world gets to cold i hope one day you rescue me & maybe we can fly someday..
danabgirl,infernal navel-gazing. hopeful despite my best intentions.
Birneyyyy01,"think globally, act locally. handling it. | junior & sticky note aficionado | hchs"
sydneyhope1206,cfa
Kahrinnn,god first. $hashtag$
ellsinator,$number$/bi as the sky/ home again home again jiggidy jig
beckynoone,food is all i need.
JazzaJewelz,live music photographer // videographer
emmagreenmodel,"welsh glamour model based in london. daily star page $number$ girl $hashtag$. for booking enquiries, please contact: emmajg24$mention$.co.uk instagram: emmajgreenmodel"
Jus2Precious,a non feminist feminist. a nigerian daughter. a british mother. an african civillian. a creative scientist......
